1601864796.0|AskReddit|poopwithjelly|"I've read a few things on men showing some higher level of blocker chemicals, but they leave it ambiguous for whatever reason and say it may chalk up to the same, as in societal queues influence the signal to the brain. I don't know if I buy that, but this is from various expertise, so who am I to say.   
  
My anecdotal experience with it isn't even close, and that is the only thing I can reliably reference. It also would make sense me that the more robust of the 2 genders adapted some ability to use that extra virility. I've also been fighting for a decade and seen a much broader injury resilience from men that I cannot attribute to societal inference. That is just my ancillary evidence, but it seems much stronger to me than the opposite case."
1601864796.0|AskReddit|ryanmechery|At the moment I thought I was going to be murdered by some shadowy figure but later woke up and realized it was just sleep paralysis.
1601864796.0|AskReddit|Captain-Sass|Food, gas, and video games
1601864796.0|AskReddit|Beautiful_Dragon22|2020. For obvious reasons
1601864795.0|AskReddit|ARogueWombat|"I had a lady run over herself right in front of the ER I was working. It basically exploded her lower leg/calf spraying fat and tissues on the ground and on the side of her tire. Turns out she also broke and dislocated her shoulder. As we are applying compression wrappings to stop the bleeding and get her onto a stretcher and into the ER, she says ""He's the one with a broken rib or something."" Referring to her ex husband who is still sitting in the minivan and in no distress."
1601864795.0|AskReddit|Lurker-of-the-web|"Zach Hemsey - The Zoo

No words, no singing, just instruments and you can still hear the passion and emotion that went into it. That is one of the best songs I heard within our current timeframe"
1601864795.0|AskReddit|Jeff_9000|Well cold water is better than no water
1601864793.0|AskReddit|nyabby-keromatsu|Yeah! Also there's his patreon where he uploads more videos that he can't put on YouTube because they get demonitised
1601864793.0|AskReddit|justanotherbodyhere|I personally liked them. Was fun to see highlights of reddit posts I missed or that I had read and commented on. I like the r/nosleep reads also.
1601864792.0|AskReddit|SoyOrbison87|Extendable steel envelopes
1601864792.0|AskReddit|BegieTV|*Pew pew* ~ *five seconds later* ~ *bomb successfully defused*
1601864792.0|AskReddit|billybobjimmyjoe|Earth will thrive again.
1601864791.0|AskReddit|nickedge11|I wanna watch it so bad. Cant wait for the digital release.
1601864791.0|AskReddit|xaanthar|You don't meet every day for a year, but yes. Grand juries are empaneled for months to evaluate evidence as an investigation proceeds.
1601864790.0|AskReddit|Mrs_Mousy|How?
1601864790.0|AskReddit|sunflowerbracelet|"Confused
Explain please!"
1601864790.0|AskReddit|cesarjulius|"i agree! and drunk driving too. people should drive sober, but in a free country people should be able to use their own judgment about what’s safe enough for them. and in fact, driving sober can actually be dangerous since a lot of drunk drivers who go limp are more likely to survive. 

in short drive sober if you want to, but drunk if you don’t. i don’t see it as anything more than authoritarian and a reduction of liberties in forcing others tooooooo."
1601864790.0|AskReddit|After-Excitement-751|I watch them. I don't mind it.
1601864789.0|AskReddit|Matster04|It already is just that, some have interesting history tho
1601864789.0|AskReddit|mac14mac|Because it goes to our alien overlords
1601864789.0|AskReddit|procrast1natrix|"Huge hugs for you about the loss of your child. I cannot imagine.  I've given my healthy kdis an extra squeeze tonight celebrating how lucky we are.  

During training, there were a few patients who came to teach us - example one who had lost a term pregnancy.  It was gutting and transformative.  It shaped a class of a hundred of us.  If this is a thing that lays on you, and you have the personality to talk about it, there are padawans to be taught.   :)"
1601864789.0|AskReddit|mikeriley66|So if it turns out after all is said and done that masks didn't work and were 0% effective, so what, what did you lose. But on the flip side what if they are effective what if wearing one does help save lives. So just wear the damn mask already. We're six months into this thing, I can't believe we're still having this conversation.
1601864789.0|AskReddit|omgseriouslynoway|I like my shrimp in a good thai curry
1601864789.0|AskReddit|solojones1138|Floating in the Dead Sea. Unlike a normal sea it's so salty you don't have to work to keep yourself up. It's one of the closest feelings you can get on earth to floating in space.
1601864789.0|AskReddit|Poobeard76|What if? Woah!
1601864788.0|AskReddit|Frigguggi|I always thought Amy Wong was hot.
1601864788.0|AskReddit|ownfkc|Odd metaphor but ok
1601864788.0|AskReddit|stchrysostom|Ask Mr. Noodle’s poodle, Schmoodle...
1601864787.0|AskReddit|AngularFrequency|Are you aware of the subreddits where tweets are screenshot from twitter so redditors can get their validation jollies by thousands of upvotes of content they didn’t write and often even crop the twitter username off the tweet? Everyone is looking for some way to make themselves feel important I guess.
1601864787.0|AskReddit|hellfireandbudsmoke|lucifer... from lucifer
1601864787.0|AskReddit|ImProbablyHammered|Charlie sheen. Cause hes got tiger blood. And would bang 7 gram rocks beforehand
1601864786.0|AskReddit|NotTheAverageMemer|Happy cake day, go to your local walmart bakery for your free cake (or whatever bakery) (this is a joke) (please laugh and give me reddit karma) (happy cake day) (this isnt related to the post) (I'm probably going to get 10 downvotes for this)
1601864786.0|AskReddit|SpnBrain|I mentioned “LOTS”.
1601864786.0|AskReddit|OxCow|Said like a true chic-head.
1601864786.0|AskReddit|DAY-B|Nofap is the panacea, the answer to every problem
1601864786.0|AskReddit|OGn00bman|Its rather simple... We can't
1601864786.0|AskReddit|Autistic_Lurker|Maybe, but like I said, probability. Scatter guns fire more randomly, they are not very precise at all. So at some point you will hit them. Your max deviation depends on how imprecise, at how many degrees off the barrel it can hit in any given direction.
1601864785.0|AskReddit|Velvet-thunder-77|Get laser Instead. I use to wax and it hurts and I hated it. Got six sessions of laser and now I'm smooth as down there and hair doesn't grow
1601864785.0|AskReddit|Natzival|technically yes, it's part of our nature to survive as species by reproducing
1601864785.0|AskReddit|IndominusWretch|"Lucifer

He's psycho 
She's crazy
Maze is amazing
Its a lot more entertaining this time around than when I was mentally stable"
1601864784.0|AskReddit|cryptic_slays|I'd be at the local subway... I'd die of embarrassment and might also have someone comment on the huge butt I have...
1601864784.0|AskReddit|mamamedic|Came here to say that.
1601864784.0|AskReddit|SundayMorningTrisha|By having everyone seated by homeroom in the gym, and having the homeroom teachers take attendance.
1601864784.0|AskReddit|fartful-dodger|Apocalypse Ow
1601864783.0|AskReddit|queen-of-the-butt|The dolphins would take over.
1601864783.0|AskReddit|Responsible_Adult1|Hairpray
1601864783.0|AskReddit|FireFlavour|Make a louder sound and assert dominance
1601864783.0|AskReddit|puppydog167|Snoop Dogg’s version of Winter Wonderland. That was a really frustrating 3 weeks in the middle of July
1601864782.0|AskReddit|Kwa_m4|Damn. That’s basically my fiancé’s story. I hope your getting past it
1601864781.0|AskReddit|Insyte-|Warzone takes a bit to run
1601864781.0|AskReddit|thatshortginge|Truth
1601864780.0|AskReddit|CompleteFacepalm|Yes. That's what made me decide to get a Reddit account. So that I can read interesting things without watching a YouTube video
1601864780.0|AskReddit|ktoner1017|Tissue or just spit it into a trash can and don't make a big scene of it.
1601864780.0|AskReddit|tarotwitchneona|A bed. More specifically, a mattress. We got a super good deal on ours but still had to go into debt to get it. I don't regret it, because it's a pretty nice one, but holy shit.
1601864779.0|AskReddit|Glittering-Inside|You forgot tongue.
1601864779.0|AskReddit|86_The_World_Please|food
1601864778.0|AskReddit|PurpleGuy-1987|"if I'm soulless does that mean I'm still affected by the extinction?

Cus if not I will be happy."
1601864778.0|AskReddit|coxmandem|Imagine what you would think when you were reading those notes not remembering talking to him aha
1601864778.0|AskReddit|Cake-Resident|My self esteem
1601864778.0|AskReddit|EmpJoker|*Deliver Ninjas to your door!*
1601864778.0|AskReddit|Ticklish_Kink_Wife|I've always played on roll20 with friends frm around the world, actually!
1601864777.0|AskReddit|Seancho22|Yeah, life experience and it made for a great story.
1601864777.0|AskReddit|contrarianbynature|Parks and Recreation.
1601864777.0|AskReddit|sipping_fire|Because killing people is bad.
1601864777.0|AskReddit|goodatbeingnotded|Starvation. I've experienced a lot of things and nothing comes close
1601864777.0|AskReddit|princessberry1222|I had to take this to google and I'm somehow more confused. Please elaborate
1601864776.0|AskReddit|Anna-and-Cinderella|Ah, it's nice to meet a fellow bisexual.
1601864775.0|AskReddit|rearl306|Coffee.
1601864775.0|AskReddit|Josh1EWawa|You have, UwU
1601864775.0|AskReddit|bardazon|"Smarter. All of the idiots would be zombies.

In fact the people left over would easily be able to work together for a cure and secure civilization."
1601864774.0|AskReddit|JosephSears|Bye
1601864774.0|AskReddit|robi983dude|If you rewatch the movie they literally try that and it doesn’t work. He never needed to die though because if she never jumped off the lifeboat back onto the titanic he would have been the one on it and she would have been on the lifeboat. So her being dumb killed him.
1601864774.0|AskReddit|pheret87|Reaction videos are not entertaining at all. I really don't understand it. I guess I get why little kids like them, it tells them how to feel but adults? I don't understand.
1601864773.0|AskReddit|lumpynose|Nutritional yeast; it's full of umami.  Plus it has lots of B vitamins.
1601864773.0|AskReddit|daggerxdarling|Have you read this shit?
1601864773.0|AskReddit|DragoniteXEgg|" I know this is not like the other posts you see, but here it goes.
I was playing minecraft tonight and a power outage hit.
I was playing on my minecraft world (Bedrock Playstation4) and my ps4 turned off.
Mind you, this was outage lasted for 3 seconds. (I know, weird) and I was playing during this outage. I rebooted my ps4 and ran Minecraft. I go to log on to my world, but when I try to join, my ps4 says the data is corrupt. Please. I have over 1000 hours on this world. Anybody, anyone, i'm desperate. Willing to try anything. Please... I have a photo on my profile with a picture of the message. I don't want to delete my world...
Help..."
1601864772.0|AskReddit|dankumz|It’s cuz there’s lots of cool stuff to, eat? Are you guys hungry? What’s the question again?
1601864771.0|AskReddit|helpful_table|Those people aren’t therapists. They’re psychiatrists. They are there to prescribe meds, not fix your trauma. Find a therapist or psychologist
1601864771.0|AskReddit|xolivas22|"Fun fact:

Not all ""fun facts"" are really meant to be fun."
1601864771.0|AskReddit|billybobjimmyjoe|Don't take ANY medication with alcohol.
1601864771.0|AskReddit|AlwaysTheNextOne|No, not at all. If you close your mouth, the air just fills your mouth and you can let it out noiselessly. I don't think I've ever had a burp go painfully through my nose. I'm talking about opening your mouth and letting out a noisy burp.
1601864770.0|AskReddit|acjgoblu|Beets. Except for when you think you're shitting blood the next day.
1601864770.0|AskReddit|aminy23|"After posting in an Indian food subreddit, I got a PM from a bot telling me to check out r/chodi, a subreddit with posts [comparing minorities to gorillas](https://www.reddit.com/r/Chodi/comments/ivskql/can_you_spot_the_difference/), and making ethnic jokes about them [courting with donkeys](https://www.reddit.com/r/Chodi/comments/ivnr4d/wanderlust/) that are fully tolerated by Reddit admin.

""Chodi"" is a combination of the name ""Modi"", and the Indian equivalent of the F-word. 

It's as if someone made a ""Trump Sucks"" and then used it to make jokes about Mexicans because they'd presumably hate Trump."
1601864769.0|AskReddit|Destiny89becomesme|Just using drawings...
1601864769.0|AskReddit|AwesomeDawn78|In my bra, they would never look there.
1601864769.0|AskReddit|TechnicalAd8934|cats saying no when they should be saying no
1601864769.0|AskReddit|Steel_Colt|Life, uh, finds a way.
1601864767.0|AskReddit|Jeff_9000|Sounds like a great day! Ty
1601864767.0|AskReddit|TheKrispyCat|"Be happy at almost all times, and feel a sense of wonderment and excitement, instead of soul crushing nostalgia and stress...

&#x200B;

Also, I used to be able to a cartwheel with no hands (idk if it has a special name) and now I can't. How the mighty have fallen."
1601864767.0|AskReddit|Twinkies71|"Ok, who the fuck gave this a ""Helpfull"" award?"
1601864767.0|AskReddit|FarOutSi|Interesting tidbit
1601864767.0|AskReddit|Chriskc9|Middle school I had a friend who lived 6 houses down we didn’t really hangout at school or like each other that much but we would go to his house he used me for my ps3 and I used him for the WiFi and to flirt with his sister it evened out.
1601864766.0|AskReddit|Garth_Zader|When they run down a train tunnel and come out the other one.
1601864766.0|AskReddit|MagentaLeopord2018|The magic bean juice.
1601864766.0|AskReddit|dillonw1991|TMZombie would be a thing
1601864765.0|AskReddit|spandanspace|"_EA_

Then I would end the period of oppression."
1601864765.0|AskReddit|CLYLMM|Not much different from the people who screenshot tweets and put them on reddit
1601864765.0|AskReddit|teldany|Google, I just searched for free community of like-minded adults openly discussing thought provoking topics of any kind while listening to any opinion with full tolerance and offering helpful advice without rules limiting anyone's freedom yet leaving no room for racism and unfriendly contributions to exist welcoming new members with open arms
1601864765.0|AskReddit|Town_of_Tacos|"When you said ""Ass over teakettle over a horse's head,"" I thought ""a horse's head"" was part of the expression."
1601864765.0|AskReddit|Boofbazoo07|Yerp
1601864764.0|AskReddit|AutoModerator|"**PLEASE READ THIS MESSAGE IN ITS ENTIRETY BEFORE TAKING ACTION.  YOU HAVE FAILED TO ASK A QUESTION IN YOUR TITLE**

Your post was removed as it looks like you failed to ask a question in your title. Double check everything, including punctuation, and try posting again. 

* **If you're wanting to tell a story or explain something, please try /r/Self.**

* **If you're needing advice of any kind, try /r/advice**

* **If you're looking for a fact based answer, try /r/answers**

* **If you're looking for something that has slipped your mind, try /r/TipOfMyTongue.**

Anything else not covered try one of the subreddits mentioned in our sidebar that better suits your needs.

If you need more clarification, or feel this was an error, please contact the mods and provide a link to this post, thanks!


*I am a bot, and this action was performed automatically. Please [contact the moderators of this subreddit](/message/compose/?to=/r/AskReddit) if you have any questions or concerns.*"
1601864764.0|AskReddit|Lord_maxseby|My virginity
1601864763.0|AskReddit|IntoTheMystic1|Brush twice a day. Floss once a day. Rinse with mouthwash.
1601864762.0|AskReddit|keatonfisher|Put it somewhere simple like a drawer in a normal room but I fill the other room next to it with as much stuff as I can get in there and make it a mess so the detective thinks that it’s in the trashed room and spends all of their time in there looking for it.
1601864762.0|AskReddit|annabelleandrusko|Under my led light strip
1601864762.0|AskReddit|FromBDale|All the jobs performed by teenagers
1601864760.0|AskReddit|thatshortginge|I forgot about Catdog! Oh the memories
1601864760.0|AskReddit|Dismal_Switch_1204|Portable Blender
1601864759.0|AskReddit|SumoSamurottorSSPBCC|I've had enough of Reddit for awhile...
1601864759.0|AskReddit|PM_me__hard_nipples|I wonder how much dating dynamics would change if humans were having an oestrus cycle.
1601864759.0|AskReddit|wolf-of-america|The entirety of the Chinese population
1601864758.0|AskReddit|ItAllDepends99|Abraham Lincoln liked to watch horses fuck.
1601864758.0|AskReddit|Zonk-Knuckle|"I didn't mean to cause insult. When I said uneducated medically, I meant in regards to their own well-being. A vet isn't a skilled surgeon, and a surgeon isn't skilled to be vet. I guess the word *""uneducated""* came off a bit strong, but I meant no insult by it. It's like I say I'm uneducated financially or uneducated in any other sense.

Plus, like you said: Not all farmers are vets. I acknowledge it isn't always so simple to identify who knows what from their field, so of course I don't assume a farmer doesn't know how to care for a cow or horse, likewise I can't assume a farmer knows how his body works. Sorry if I made you feel bad about this, friend."
1601864757.0|AskReddit|InvisiVoid|In the gravel of my fish tank.
1601864757.0|AskReddit|R_Vaidhya|Not yet but happy cake day
1601864756.0|AskReddit|JakeArrietaGrande|"> I'm pretty patient.

No, you're pretty EMT"
1601864756.0|AskReddit|weapon4x|"Dungeon Crafting Series

Bobiverse

Expeditionary Force - be hooked after chapter 10

Chaos Seeds 

Divine Dungeon Series 

New Era Online

Dark Herbalist Series

The Shadow Master 

Magic 2.0

Starship's Mage  

Super Sales on Super Heroes

Everybody Loves Large Chests - not what your thinking

&#x200B;

#"
1601864756.0|AskReddit|maxwellhuracane|a green silicone ring. yesterday I bought a book by Julius Evola.
1601864756.0|AskReddit|Not_A_Diabetic|Disc golf. Once you start its super addicting
1601864756.0|AskReddit|kitty-94|I like them. I listen to them while I'm doing dishes or cleaning, etc. They pick good stories to go off of. I prefer the ones that give an oppinion after the post instead of just reading them out.
1601864755.0|AskReddit|Imispellalot|Don't feel like I deserve anything.
1601864755.0|AskReddit|gnomesteez|Hell yeah brøther
1601864755.0|AskReddit|Ninotchk|It's a self fulfilling prophecy, too. If you see a doctor and are helped you are more likely to go again. Although normally it's the other way around and you spend years begging for anyone to take your pain seriously and give you a diagnosis. And if you're lucky that diagnosis has a treatment.
1601864755.0|AskReddit|Informal_Laugh_6064|A jar that I had filled to the brim with change from when I was about five. Still have no idea what happened to it, but am convinced one of my siblings had something to do with the disappearance.
1601864754.0|AskReddit|RakhaV|The Thin Blue Line
1601864754.0|AskReddit|TurkPowers|2 Friday nights ago?
1601864754.0|AskReddit|TheAnimeWaifuFucker|Survival selfies on Instagram, tutorials of how to survive on YouTube and we would be ranting about things here on Reddit.
1601864753.0|AskReddit|TrueEgon|"""Oh Long Johnson, oh Don Piano."""
1601864753.0|AskReddit|Boiler2001|Maybe not simple, but if you're overweight, lose weight.  When you lose the round shape and the facial bone structure becomes visible, most anyone will look more attractive.
1601864753.0|AskReddit|Infinityjupiter|If you’re in the market you’re a nerd. Chicks dig nerds
1601864752.0|AskReddit|payperplain|0
1601864751.0|AskReddit|SoyOrbison87|Greg Poomly’s bit about life on a spaceship full of sleepy weasels.
1601864751.0|AskReddit|LilacSlumber|"When you're very young (0 to 5 yrs), you have no idea.  Once you're old enough to realize it (7 to 10ish), you get super embarrassed.   When you're around the age of going through puberty, you start to apologize to people for your mom or dad's behavior.

Then, FINALLY, you are old enough to get away (14 to 18) and if you're lucky, you have a lot of excuses to not go places with them - practices, games, rehearsals, concerts, homework, a job.... and so on.

When you're an adult, if you have the balls to do so, you start to point out to them in the moment how absurd and ridiculous they are acting and they learn to not act that way around you... but they still do it when you're not around.  You're not around a lot."
1601864751.0|AskReddit|LiLMosey_10|Using one of those electric shaky bois that all the tiktokers use
1601864750.0|AskReddit|pokemaster1701|Peepee poopoo
1601864750.0|AskReddit|anniebyers3|If you take care of a dog, they thing you are a god but if you take care of a cat they think they are a god. You decide
1601864750.0|AskReddit|invisible_23|I’m wearing nail polish so that’d freak them out too
1601864749.0|AskReddit|MilitantPacifist13|Like Trump.
1601864749.0|AskReddit|IKnowFKAll|"Not ""bowls"", A bowl, my bowl.
It wouldn't be hygienic to go dipping my dick in other people's bowls of cum. I don't know what they did to those bowls.
I know where my bowl has being. Just don't ask me about the guys who cum in it, I can't honestly keep track."
1601864747.0|AskReddit|csscncr|I hear you. I’ve taken that test 3 times. Result came back as deceptive answers or too literal. 🤷‍♂️ The chain restaurants love using it.
1601864747.0|AskReddit|fartful-dodger|aging Bull
1601864747.0|AskReddit|DAY-B|Spit don’t swallow
1601864747.0|AskReddit|WantsToSeeYourTits|"All boobs are good boobs to me.

Same for butts.

Same for labia."
1601864747.0|AskReddit|FalloutFan05|Everything
1601864746.0|AskReddit|Random_posts_22|I'm on the second floor, and I'm not in one of those places with huge ancient structures. Yeah, I'm fucked.
1601864746.0|AskReddit|hellfireandbudsmoke|no
1601864745.0|AskReddit|LageNomAiNomAi|What is the level cap these days?
1601864744.0|AskReddit|minertyler100|Chicken, pork, steak, etc
1601864744.0|AskReddit|hoop-d-lishus|London broil is good on the grill.
1601864743.0|AskReddit|Zayyan_Jabri69|Nah, I don't have any of the symptoms, possibly just a visual thing?
1601864743.0|AskReddit|chasing-daylight|back in the 1960's they said smoking was healthy...60 years later now you think vaping is healthy....60 years from now when your ignorant ass is hooked up to a ventilator what will be your excuse!?
1601864743.0|AskReddit|BegieTV|A kid
1601864743.0|AskReddit|Commercial-Way-7493|I’m an idiot in math. I understand it but I still have people tearing me down calling me a dummy
1601864741.0|AskReddit|CaptainBritish|Illuminaughtii has kind of moved on to more original content now. I'd still recommend checking out her new stuff though, she has a great series breaking down different MLMs.
1601864741.0|AskReddit|Wardog008|I have yet to get sick of the John Wick movies. Knowing the sort of training that went into making those movies, and the fact that they're damn good as stylised action movies just makes them endlessly entertaining, compared to most of the garbage action movies we've had recently.
1601864740.0|AskReddit|theyusedthelamppost|"because the steep penalty incentivizes players to follow the rules.

If the penalty didn't fit the crime, then players would just commit interference all the time and there would never be offense."
1601864740.0|AskReddit|sky_and_sea|I'm sorry for your loss
1601864740.0|AskReddit|spacetripss|Coming to an end?
1601864740.0|AskReddit|retrotransposon1|LoL, the Slayer from Doom Eternal. Funny Thanksgiving, I'm sure.
1601864740.0|AskReddit|NerdismOfficial|Go-juice
1601864740.0|AskReddit|rawrxdlmoax3|Same
1601864739.0|AskReddit|Kinky_RedHeaDd|A condom, lets face it we got fucked
1601864739.0|AskReddit|Dude306306306|Over the Garden Wall
1601864738.0|AskReddit|LittleHouseNoPrairie|I am a registered donor, but I have heard people say they wont do it because they fear a doctor or medic treating them might let them die if they have a family member who needs an organ.
1601864738.0|AskReddit|Iminawhiteboxyt|Side question: what memes would be made
1601864738.0|AskReddit|thatshortginge|"You’re 100% right about small dogs being annoying.

Cats just seem in my opinion, like the either hate you, or love you. Does that make sense?"
1601864737.0|AskReddit|NothingHereAfterAll|Cupcake and Dino
1601864737.0|AskReddit|antonspohn|Jitter
1601864737.0|AskReddit|Mrs_Mousy|No, I wouldn't want to live the rest of my remaining days. I also think that people shouldn't make huge decisions like that solely based on what their friends and family want.
1601864736.0|AskReddit|Killashard|"2 main reasons for that.  

1.  Politics/Election Year. That always brings out the well informed and polite people.

2.  You've matured and grown from where you were before."
1601864736.0|AskReddit|supposubly|Happy cake day!
1601864736.0|AskReddit|RyansRoar|First thing I thought of
1601864736.0|AskReddit|TimeWizardGreyFox|I feel as tho the comments will bias towards children of Karen who don't agree with their parents behaviour and less of those with Stockholm syndrome.
1601864735.0|AskReddit|abeast0333|Cheaters never win. Of course they do, it's just about not getting caught.
1601864734.0|AskReddit|coxmandem|That's really cool! Hope you can find his stories :)
1601864734.0|AskReddit|link1652|With my other paper clips.
1601864733.0|AskReddit|MakeItHappenSergant|Sure, it goes in the laundry pile.
1601864732.0|AskReddit|_Exotric_|If I remember correctly, he was hit with the killing curse. So he was dead either way.
1601864732.0|AskReddit|KawaiiDemonBunny|Red dwarf
1601864730.0|AskReddit|pikaland385|"marksmanship + 25

Farming + 50

aviation + 75"
