1601864847.0|AskReddit|aplanefan|This guy lawyers
1601864846.0|AskReddit|fartmaster115|I actually enjoy them, I know they take zero effort to make but there perfect to throw on and mindlessly listen to Reddit will doing other things.
1601864845.0|AskReddit|Aizakku_a|A meme that I’ve seen 10 different times that same day; a repost. Someone simply just being an asshole or condescending. There are many more examples but I’m sure you get my point.
1601864844.0|AskReddit|wholelee343|Cows but like BIGGER
1601864844.0|AskReddit|NotYourSnowBunny|"I wear a mask. 

Because it's proven to be effective and I don't believe doctors that talk about demon sex in dreams and bleach. That isn't science, that isn't medicine. I also didn't need the media to tell me any of that, I have a memory, I remember how SARS put the world in panic mode for a minute way back when. Precaution should never be labeled as paranoia. Masks seem self explanatory, as most of Asia adopted their use during the afformentioned prequel epidemic. 

I'm not the brightest knife in the old toolbox, but I do have some common sense. It's not about control, the government gassing and beating its own citizens is about control. This is basic decency during a global pandemic. I also long ago moved past the whole conspiracy mindset. The world is a disorganized shitshow, most everyone's just grinding to get by, not everything is a fucking conspiracy. Yet the internet goes wild, calls it a plandemic, anti-maskers spread their disinformation across every social media platform, and can't seem to fathom the idea that they're protecting other people. Like *what the fuck, America.*

I see why psychologists said that people who refuse to wear masks exhibit signs of psychopathy or sociopathy. There's *no regard* for the well being of others, *whatsoever*. They think everyone's a sheep, which is a reg flag word in-and-of itself. It's some frightening delusional thinking. Hell, I know a person who has labeled everyone who wears masks as mentally ill. That shit stings like all hell. The world is burning and nobody seems to be able to muster a fuck."
1601864844.0|AskReddit|lurkylurkeroo|"My dad did this - except he is a Dr.

I fell off my bike when I was seven, and fractured my right ankle. He declared it was sprained and nothing was done about it. Didn't even go to get out checked out.

Messed up my gait which hurt my hips, and had ankle problems into my 20s."
1601864844.0|AskReddit|goldenlover55|I've never realized there was room service in the ER.?!?!
1601864844.0|AskReddit|miss_oreo|“TL, DOCTOR” gets on my nerve hahaha
1601864844.0|AskReddit|anniebyers3|You tend to figure out what’s overpriced quickly
1601864843.0|AskReddit|princessberry1222|This is true
1601864842.0|AskReddit|Tricky_Rabbit|Alcohol - It's Five O' Clock Somewhere
1601864841.0|AskReddit|humphreygrungus|It's a place, we have stuff here. Also things.
1601864840.0|AskReddit|Much_Difference|Oh yeah he does it for sleeping, too. I can't even begin to fall asleep with that noise though so [we own a handful of these](https://www.amazon.com/Headphones-Bluetooth-Headband-Sleeping-Headbands/dp/B07QLF7WHZ) and they work spectacularly. In case you're ever sharing a bed with someone who can't fall asleep with the noise.
1601864840.0|AskReddit|SoyOrbison87|Cheese spreading claw
1601864840.0|AskReddit|MilitantPacifist13|There’s a chicken that literally is everything black inside and out.
1601864840.0|AskReddit|MeX1canBurrit0|Not neccesarily. This is why their is a food chain. Because different animals over power others but in the grand scheme of things that is what keeps the balance. If one animal was to have no real predator the scale would tip more towards one side and all would follow. Weak and defenseless is too subjective to generalize. For example worms thrive but they all  are weak and defenseless to virtually every creature, in comparision rats and mice would take over all the worms and they would cease to exist but hawks fly down and eat the rats and mice thus keeping balance so that way everything in this world lives and when its time is to die out it will do so when the conditions are right. A baby elephant is still a baby but has the power to stomp over and kill a human if it needed to. At some point when we were closely like apes even being an infant was hard but we had are advantages just like baby elephants do ,its why we have survived so long and haven't died out since or been over taken by another species. Its evolution.
1601864839.0|AskReddit|toad__warrior|VPN and running your browser in private mode is the answer here.
1601864839.0|AskReddit|nama1128|Think he means bird shit
1601864839.0|AskReddit|javanator999|On gluten free quinoa based bread.
1601864839.0|AskReddit|tina2step|In a book
1601864839.0|AskReddit|Tall_Mickey|While it is made harder to get help otherwise.
1601864838.0|AskReddit|BackToThe00s|Sweet heavens no haha it's the ACDelco ones you find at o'reilly's. Thanks for the heads up though!!
1601864837.0|AskReddit|coxmandem|What if in what ever afterlife they are living in, they are able to remember the 1 hour?
1601864837.0|AskReddit|seeteethree|"It's a public affirmation of your devotion to one another.  It says to the world at large, ""we're in this for the long haul."""
1601864836.0|AskReddit|gnomesteez|Oh that’s dope. Smoothies at work?
1601864836.0|AskReddit|usmarine7041|The Olive Oil Challenge
1601864836.0|AskReddit|Imispellalot|I'll take the blue pill
1601864836.0|AskReddit|SilverDefinition3203|Fiend
1601864835.0|AskReddit|attackedmoose|Ripely from Alien, Mac from The Thing, and Will Smith’s character from Independence Day.
1601864835.0|AskReddit|arandomkidonreddit|and softcore child porn
1601864835.0|AskReddit|SYOF|"Subclass Southern

+10 food

+10 music

+25 hurricane tolerance

-50 peaceful coexistence in diverse society"
1601864835.0|AskReddit|TrevoAB_Yes|"im not telling you,


ok i got the funny gone

under my carpet (not rug), i have the means to put it back correctly"
1601864835.0|AskReddit|GenericDadUsername82|Getting arrested for DWI. Enough said.
1601864834.0|AskReddit|DrossDespondent|"Over 4,000 know religions, how can only one be correct? Yet, if I believed every story I heard, I wouldn't even be able to walk down the street without fear of the sky falling. You know, Jesus wasn't the only one who claimed to be the child of God. Jim Jones faked his ability to heal physical afflictions with faith alone, he claimed it was because he was the son of God. It ended in a litany of abuse and the mass suicide of numerous men, women, and children. That is not a unique story, it had happened before and it happened after. At some point, you have to realize that the stories were created out of self-interest. 

Furthermore, any God could only exist outside of all known laws of physics and chemistry. The first law of thermodynamics, the law of conservation of energy states that energy can neither be created nor destroyed - only converted from one form of energy to another. 

Early in the 20th century, Einstein figured out that even mass is a form of energy (this is called mass-energy equivalence). The amount of mass directly relates to the amount of energy, as determined by the most famous formula in physics: E=mc2. Yet, God is told to have created the world and man out of sheer willpower. He is always, He is whatever mass or energy he chooses to be. He exists outside of the system, perpetuated only by our magical thinking. 

There are very specific biological process in the brain that cause thought to occur. In order for your brain to think, you need nerve cells that can detect information about the outside world and can transmit that information to other nerve cells. It’s the transmission of information, the cells talking to each other, that’s the fundamental physical basis for how thinking works. When a single neuron fires, it is an isolated chemical blip. When many fire together, they form a thought. By extension, the whole brain is also an electrochemical machine. The neurons are connected in enormous networks. The receiving neuron registers the chemical signal and converts it to a new electrical signal, which is computed in the neuron's central body. 

One to five minutes after death, the brain is hit by a process called terminal spreading depolarization (SD) – or, in less scientific terms, a “brain tsunami”. In its most basic form, this is a wave of neuron activity that starts in the deeper brain structures and radiates outwards, unlike the previous burst of neuron activity, which hits all areas of the brain simultaneously. Importantly, it signifies the breakdown of the brain’s electrochemicals (the substances responsible for keeping our neurons alive and functioning) and marks the point at which the capacity for brain function and awareness are lost. 

When brain activity has ceased, thought continuing to occur would defy the law of conservation of energy in both physics and chemistry. Meanwhile, the blood forms clots, the fat liquefies, and the corpse turns a lovely green color. All the while, the body’s enzymes continue to digest its own organs. Those without much fibrous content (such as the brain) will be the first to go. Those with more fiber (like the heart and uterus) will stick around longer. 

The rotting body is becoming a sweet home for flies, maggots, and other insects. “Almost from the moment of death, or even before in some cases, flies will lay eggs on the body – usually around the nose, mouth, and eyes, and maggots will hatch and begin to consume the body,” Hamilton told IFLScience. By day seven, the greedy grubs are able to consume up to 60 percent of the corpse. 

As decomposition proceeds, anaerobic bacteria primarily within the intestinal tract, produce gases resulting in bloating followed by the purge of fluids and subsequent release of nutrients and microbes into the underlying soil. 

These processes of decomposition are the conservation of energy at work. The total energy remains constant, and is conserved over time. That is evident, at no point does your brain teleport to some mystical realm where you get everything you want. The biological processes in your brain, no longer have a place to occur. Just as a God has no system to support his ethereal existence. 

Furthermore and to quote Epicurus, ""Is God willing to prevent evil, but not able? Then he is not omnipotent. Is he able, but not willing? Then he is malevolent. Is he both able and willing? Then whence cometh evil? Is he neither able nor willing? Then why call him God?"""
1601864833.0|AskReddit|TWFM|/r/tipofmytongue
1601864833.0|AskReddit|theforceisfemale|Waiting for some Walter Reed doctors to speak up
1601864833.0|AskReddit|PapaTwoToes|Not mine but my brother's Game Boy Advance that I just can't find.
1601864831.0|AskReddit|yMidget|Probably because they're dying from other stupid life choices.
1601864831.0|AskReddit|Tar9etPractice|Mud
1601864830.0|AskReddit|queen-of-the-butt|Put the volume up.
1601864830.0|AskReddit|LessThanLuigi|Some good emo music.
1601864830.0|AskReddit|TwilitSky|In my intern (we were only 2 years apart in age and I waited until the end of the internship for dating).
1601864830.0|AskReddit|RedHexmaster|Bless your heart.
1601864829.0|AskReddit|AutoModerator|"**PLEASE READ THIS MESSAGE IN ITS ENTIRETY BEFORE TAKING ACTION.**

Your post has been removed as it violated [Rule 2](http://www.reddit.com/r/AskReddit/wiki/index#wiki_-rule_2-). Please check that your post doesn't contain the following issues:

* **Your post cannot have first person pronouns (I, me, my, etc)**

* **Your post can't be specific to your situation or involve a story. Please make sure to depersonalize your question (such as removing personal pronouns) and remove any unnecessary context before posting it again.**

**Please use one of these subreddits:**

* Need advice? /r/advice or /r/self or /r/relationship_advice

 * Can't remember something? /r/TipOfMyTongue 

 * Looking for a particular subreddit? /r/findareddit.
Please note - once posted, the titles cannot be edited. If your title breaks the rules, please feel free to [make a new post](/r/askreddit/submit?selftext=true) that fits within the rules.


*I am a bot, and this action was performed automatically. Please [contact the moderators of this subreddit](/message/compose/?to=/r/AskReddit) if you have any questions or concerns.*"
1601864829.0|AskReddit|solojones1138|I am am introvert who has got to work from home for eight months and counting...
1601864828.0|AskReddit|botbattler30|You could’ve kept the Gamorra that Thanos brought with him. She turned good.
1601864828.0|AskReddit|ItsCalled_Freefall|Lol you still have recycling?!?!?!
1601864827.0|AskReddit|potato_in_a_sock|Punishment
1601864826.0|AskReddit|ghostsugar_|Work - I was just trying to make some money one summer in college so I worked a summer job at the factory my mom worked at and that’s where I met my boyfriend
1601864825.0|AskReddit|SlowMobius650|Stay focused on your future and what you want to do in life. It will come a lot faster than you think
1601864825.0|AskReddit|VengefulRainbow|Bro they straight up brought the Gamorra from the past to the present - they could have done this with Black Widow as well.
1601864825.0|AskReddit|over_clox|So what's your story OP?
1601864825.0|AskReddit|LopensLeftArm|Started just before Mists of Pandaria. Finally dropped it during Battle for Azeroth.
1601864825.0|AskReddit|WF6i|"But you said  ""from old school cartoons""  not ""from four certain cartoons I saw once""  That makes it a completely meaningless statement.  I could easily cherry pick cartoons and say that ""all dogs from old school cartoons are beagles"" and it would be just as true as what you said.

The only true statement you could make is that the dogs in two cartoons you could think of and another you couldn't were great Danes. that  would not be much of a statement, but it would be true.  They way you worded it is just plain false, there are many old school cartoons with many different breeds of dogs and great Danes are no more common than other breeds.

Your original statement:
The only cartoon dog from old school cartoons like The Jetsons, Scooby-Doo, Clifford, (one other old cartoon that ive forgotten now) that isn't a great dane is Clifford."
1601864824.0|AskReddit|Rozzi999|they are cool bc they put the ppl so
1601864824.0|AskReddit|Ninotchk|No young girls burned to death while cooking?
1601864823.0|AskReddit|ModestOperator|Cross my heart and hope to die, stick a needle in my eye...
1601864822.0|AskReddit|SoyOrbison87|Ham jacket decision
1601864822.0|AskReddit|PackPup|Sudden sinking feeling in all stomachs. Then a warm relief, remembering what was taught to me when I was a calf. I wouldn't exist without human cow domestication. I owe my entire life to these creatures. The food and protection they provide to me could never be gained by any other means. I hope I'm the best loaf possible for that will bring stronger protection and more food to my future calf's. I should do some zoomie shit right now.
1601864821.0|AskReddit|ProwlerPlayzYT|At least most of them still make content of their own
1601864821.0|AskReddit|aplanefan|For $500+/hr, I’d happily film a paternity test.
1601864821.0|AskReddit|iheartcrack666|Carol from TWD
1601864820.0|AskReddit|ArborghastGod|Haha no it isn’t.
1601864820.0|AskReddit|Its-my-dick-in-a-box|"Why is reddit so obsessed with therapy. Is it an American thing? I'm from Europe and don't know a single person who's been to therapy. I've had friends try to kill themselves, be committed into mental hospitals and had major depression and they've all worked through it themselves with friends and family. 

I can understand the benefits of a therapist in certain situations but I don't think its a healthy way to deal with stress! Everyone has stress, its much healthier to work through it yourself if possible than to go and expect someone else to fix it for you."
1601864820.0|AskReddit|clupusfamiliaris|My non-arthritic knees
1601864819.0|AskReddit|Kuehlapis|Black rock
1601864818.0|AskReddit|squidsquidsyd|I don’t find them ideal, mostly because the text to voice doesn’t always work very well, but definitely feel like they have their place. Normally I’ll use one of those videos if I want a good reddit story while eating breakfast or something - an instance where I don’t have my hands free to scroll on my phone. Also good for listening while not watching a screen as I often get severe headaches from too much screen time. They’re a little weird but I do use them!
1601864818.0|AskReddit|Guns4224|Our opinions are different.
1601864817.0|AskReddit|winoveghead|Frozen veggies, preferably peas or broccoli
1601864816.0|AskReddit|Random_redditor3626|Fun fact! This is the 1759 time this question has been posted here
1601864816.0|AskReddit|torileighxvl|I like to listen to them before I go to sleep😂 I’m not sure why but it bores me out so bad with the robotic voice I just have to fall asleep. I love background noise!
1601864816.0|AskReddit|Grape-Julius|I have to think that baby harp seals would be near the top of the list, and they’d probably speak out against the scum that club them to death for their pelts. I’d side with them any day.
1601864814.0|AskReddit|Okayifyousay|My kid to fall asleep so I can sneak out of her room
1601864813.0|AskReddit|MMMojoBop|American Health Insurance
1601864813.0|AskReddit|Rezurrected188|Get that money
1601864812.0|AskReddit|Adonis0|"Poison resistance +20
Fear resistance +50
Survival Skills +10
Intelligence -10
Charisma -40"
1601864812.0|AskReddit|gansi_m|Ignorance.
1601864812.0|AskReddit|fakeshaf|Is no one going to talk about how 2 meters isn’t a cliff? Like I understand that’s a long way for an old lady, but still.
1601864811.0|AskReddit|Garth_Zader|Got fish
1601864811.0|AskReddit|PunkOnTheRocks|Shitting in the chocolate river
1601864811.0|AskReddit|TheKrispyCat|I am a Pirates of the Caribbean mug... could be worse I suppose?
1601864810.0|AskReddit|TechChad69|Still, aside from uni connections I could find a better software job without the ivy league grind.
1601864810.0|AskReddit|whitetrashmilli0923|RSlash on YouTube and spotify
1601864810.0|AskReddit|dankumz|Teriyaki salmon with pineapple mmmmmmm
1601864810.0|AskReddit|Jeff_9000|Gl
1601864809.0|AskReddit|NorthernLaddd|Because everytime I smell cotton candy, I think there's a vendor nearby and maybe I should get me some. But nooooo, its just fuckin Kyle and his pals vaping so much it created a literal cloud. And my hopes and dreams of cotton candy get shattered Every.Single.Time
1601864809.0|AskReddit|StormheartGaming|I think Shrek is the next logical choice
1601864809.0|AskReddit|nicko141|Im in rural Australia so probably get eaten by some big extinct dog or something
1601864809.0|AskReddit|user12737483|Going to any extent to get sympathy from others - even making up stories or throwing people under the bus if that’s what it takes.
1601864809.0|AskReddit|Code347|Foot fetishes just got more fetishy.
1601864808.0|AskReddit|-whatthehelliswater-|Not aware. But far as I know they're mostly a good idea. They bring more people to reddit, which is probably.a bad thing in the grand scheme of things but good in the short term. They also share information from reddit that would otherwise never have gotten to that audience. Furthermore the people who do get all those views likely profit from it without exploiting others.
1601864808.0|AskReddit|wewilldieoneday|Wait, you guys get pies?!
1601864808.0|AskReddit|princessberry1222|Omg is this true? This is definitely a fun fact
1601864808.0|AskReddit|psychedelicpeakfreak|That’s mine as well! Just began making them again !
1601864808.0|AskReddit|ButlerInBoyShorts|Haha sure did
1601864807.0|AskReddit|ThreeMoreLemons|I wasn't unhappy before, don't read too much into it
1601864807.0|AskReddit|DeepFriedDistortion|Bean
1601864807.0|AskReddit|dtaylortx|"There actually is profit to be had in colonization, but it's in minerals extraction primarily. It's for the same reason that we expanded to the Western hemisphere from Europe after Columbus' failed attempt at navigation.  
Seriously what made him think that going East would get him to India faster? Did he think Magellan was just an elaborate prankster? smh."
1601864807.0|AskReddit|MakeItHappenSergant|New New York
1601864807.0|AskReddit|tiparium|Outside back molar
1601864806.0|AskReddit|pool04d|"Its so sad that reddits turned into a place that shuns any opinion thats not in line with the reddit hive mind. I remember when the standard for not getting downvoted was just to be polite didnt matter your opinion.

We are heading into a age of increased closed mindedness with the success of tiktok and every other platform copying the ""for you page"" style of content presentation. Because generally people dont like to see opposing opinions."
1601864806.0|AskReddit|Responsible_Adult1|Passion of the Chris
1601864805.0|AskReddit|-just-an-idiot|the break happened in gym class and i could barely lift my arm high enough to get out of my shirt, almost cried. went about the rest of my school day normally, albeit fairly lightheaded
1601864805.0|AskReddit|ApocalypseTacos|I was/still kind of am afraid of forklifts. I don't know what it is about them, but I used to run screaming whenever one showed up at the Lowe's/Sam's club/whatever. Now I don't run, but my palms do still get a little sweaty when I hear one, especially if it's coming down the aisle toward me.
1601864805.0|AskReddit|commandrix|Good on your mom for, like, doing whatever the opposite of dismissing your obvious medical problem is. Might also have that painful period thing checked out too.
1601864804.0|AskReddit|Cromslor_|All the dudes with small dicks reading this telling themselves it's all ok.
1601864804.0|AskReddit|PurpleGuy-1987|aubergine man.
1601864804.0|AskReddit|charlie_chapped_lips|"It takes away a lot of financial advantages and tax breaks. Imagine for a moment you have kids. If you aren't legally married you get a ton of benefits and government help. Getting legally married is just a terrible financial decision on so many levels, even if it works out. I get people are religious, which is why marriage is still a ""thing"" but just get married in a place of worship of your choice and faith and leave the government out of it."
1601864804.0|AskReddit|010000110100111101|lololololololllllll!!!
1601864804.0|AskReddit|Jeff_9000|Me too
1601864803.0|AskReddit|xtrachromo_man|Idk, die ig
1601864803.0|AskReddit|s-bagel|Anything other than tall rectangular windows are brutal.  We have stupid wide short widows. Turns out you pay for the width grr.
1601864802.0|AskReddit|Bluebird_azuite|r/holup
1601864802.0|AskReddit|ljaffe19|I’m sorry to hear that. I can understand that though... it’s definitely a hated job. If we intervene, people hate us. If we don’t, people hate us. I can’t speak for all workers but in my office in my state, I’ve gotten to work with amazing, kind hearted and passionate social workers who truly want what’s best for the kids and families they work with. I know it can’t erase the trauma of what we do, but we try our hardest to minimize the impact wherever possible.
1601864802.0|AskReddit|coxmandem|I'm sure she would like that!
1601864802.0|AskReddit|GeezerEbaneezer|Two buckets were stuck together one in the other. You can hit the side of the bucket on something to separate them, in this case the shelves inside the work truck. They wouldn't separate, so being the maniac he is, he just starts swinging them apeshit and somehow, someway, the bungee cord hanging on the shelf ended up in his lip.
1601864802.0|AskReddit|IntegraScout|So they have to spend their lives alone because they didn’t find anyone they wanted to sleep with before getting out of high school??
1601864802.0|AskReddit|TinyTwisty|Wigs. I can be a different person every day.
1601864800.0|AskReddit|ididntaskyoukaren|You’re correct! And thanks(:
1601864800.0|AskReddit|thatshortginge|I can agree with this!!!
1601864800.0|AskReddit|hoop-d-lishus|A 8bit plumber...
1601864799.0|AskReddit|Mrchikkin|Along with America has +50 Bat wielding ability
1601864799.0|AskReddit|Statoneryaddict|Not really. Your information takes in account basically nothing and they even say it in the article. It also only talks about push-ups. If you provided us with a scientifically accurate study that shows that men are stronger than women on a biological level, I wouldn’t think that you’re sexist and profoundly irrational.
1601864798.0|AskReddit|PorkrollPosadist|Buy guns and ammunition.  Support the Communists.  And whatever you do, don't cross the transfolk.
1601864798.0|AskReddit|MerkNZorg|Yea you have to do your research
1601864798.0|AskReddit|masterneedler|Batteries! Omg all the gameboy batteries I went through as a kid
1601864797.0|AskReddit|thegabster2000|I no longer see him but he texts me time from time. We have mutual friends so he is bound to see me. I no longer see him the same way.
1601864797.0|AskReddit|qzen|"... but Megatron was reaching for that gun that was out of Prime's line of sight!

I mean, yelling ""he's got a gun!"" might have been a better solution, but you never know how you're going to react in the moment. Shit was tense!"
