1601864991.0|worldnews|jtbc|It boggles my mind that anyone with a Jesuit background could even tolerate the thought of someone so anti-intellectual, and anti-reason, who also does absolutely nothing, not one thing ever, in the imitation of Christ.
1601864989.0|worldnews|VenomousTwat|"Convert the value of your private healthcare and the fees you have to pay per year into effective pay, and then see if it is more expensive. Anyone making normal people money is going to see a decrease in the effective cost of healthcare as compared to private healthcare. The data is all there, we pay WAY more in the US per capita for healthcare yet our life expectancy is one of the worst in the developed world. The data is all there, read about it. 
https://ourworldindata.org/the-link-between-life-expectancy-and-health-spending-us-focus"
1601864988.0|worldnews|jbeale53|Exact same scenario last night, saw Mars on the nightly walk with my dog then got home and watched the last episode of Away.
1601864985.0|worldnews|311polo|It has indeed. But neither socialism or capitalism is inherently evil. What history has shown is that often the evil of certain individuals result in the system's failures or issues.
1601864980.0|worldnews|RedTerror88|[Critical support for the....*checks notes*....Vatican?!](https://www.barnhardt.biz/wp-content/uploads/2015/07/pope_sickle.jpg)
1601864974.0|worldnews|martij13|Thanks for bringing good info to this thread.  You hit the nail on the head with your comment about cost.  I grow birds on pasture and people faint when they see what we charge.  Some of the high cost is labor and feed and so on but it costs us more to just to process a bird than our local supermarket charges.  There's a market for it and I think our chicken tastes much better but we're absolutely producing a luxury product.  Anyway have an upvote or three.
1601864971.0|worldnews|shazoocow|Smoke... Check!
1601864964.0|worldnews|BigFitMama|"They are just upgrading their playbook and the demo data is all there right from out of the Trump 2016 election meta plan and the related ISIS plans on how to radicalize white, poor, and disenfranchised people.

(Trump himself did not build this plan. Pascal and Cambridge Analytica plus foreign interests developed it and tested it previously in other elections worldwide.)"
1601864964.0|worldnews|MiltonFreidmanMurder|"in theory is doing a lot of legwork here. 

China is about as representative of the people as Vladimir Putin is. 

Putin isn’t a democratically elected leader, and China isn’t exactly a communally organized government lol"
1601864964.0|worldnews|Godaddy123321|Brazil is one of the worst countries to live in along side the US and Russia. What a disgrace to anyone who believes in their leaders.
1601864948.0|worldnews|bodhasattva|"I read once that the amazon rainforest is the lungs of the earth. Alot of our oxygen comes from there.

So im just thinking to myself, at what point does the rainforest become world property? Meaning we (and the rest of the oxygen breathing nations) step in and say ""this is going to be protected, with or without you""."
1601864948.0|worldnews|get_off_the_pot|"> I had already mentioned one comment above that the Khmer Rouge fell after their failed invasion of Vietnam.

You only mentioned this *after* I said you have a basic comprehension. 

> As well as the fact that the US gave some diplomatic support to the Khmer Rouge after they were removed from power.

Link to where you said that?"
1601864946.0|worldnews|Fairymask|One thing is for sure. Yes climate change is the cause but we need to be doing more to prevent what we can at this point and not just saying well it’s climate change nothing we can do. Whether that’s spending more money on back burning or what I’m not sure. I’m just not hearing a whole lot of talk on solutions going on. And I mean solutions besides changing our ways of life to help counter act climate change. Yes, we should absolutely be doing that way more then we are but that change isn’t going to happen over night. In the mean time we need to be working on other solutions.
1601864940.0|worldnews|ThePrem|How do you suppose? They both have about 7,500 active cases per million people? And the US is trending down while France is trending up. Not to mention that the US has had much more success treating the virus with 4% death rate vs France with a 25% death rate (6.25 times more likely to die).
1601864935.0|worldnews|Hyperian|Yep, that's what happened to me. Closed the site cause all I saw was pics of ads. When to comments and looked again.
1601864929.0|worldnews|Mikimao|"> He says posting from his iphone

wrong again, and your reasoning that people wouldn't be able to communicate in such a way isn't because of capitalism, the way it's monetized and the winners of that game is the result of capitalism.  If you are asking my personal opinion on the matter, I would rather be paying the government for my net access than Spectrum.  I bet I would be getting a superior product for less money if I was, especially when you consider the horrible practices their monopoly has created, but this is beside the point.

All you are doing is distracting from the main point, which is capitalism has selected the already wealthy and powerful in a time of crisis, in favor of the majority of people.  And I will double down in saying yes, the continued process of selling more consumer goods at the expense of the nationals health is sickening.  That is totally exclusive from yes, I understand we all need to do things to pass the time and keep us sane, I certainly have and I would expect anyone to do the same, but it doesn't mean we need to put the nation at risk to continue the process.  Capitalism isn't telling you to pass the time with what you already have, it's still trying to get you to buy new stuff when collectively it's not the best for us right now."
1601864922.0|worldnews|hawkeye315|"Hmmm, let me think... Every single ""communist"" sovereign nation that has ever existed? Each was was a statist dictatorship."
1601864919.0|worldnews|MasterKeef1992|Absolutely nothing because I am as insignificant to this problem as you are. But I can at least make you read my opinion. Have a nice night
1601864915.0|worldnews|hegemonicht|No rich person has to live in the real world so that will never happen unti money leaves politics. So never.
1601864912.0|worldnews|governmentNutJob|"I dont think anyone wins the trade war, but China are definitely feeling the effects more than you would realise 

&#x200B;

[https://www.reuters.com/article/us-health-coronavirus-china-manufacturin-idUSKBN21D0IG](https://www.reuters.com/article/us-health-coronavirus-china-manufacturin-idUSKBN21D0IG)

&#x200B;

Of course getting any genuine data out of China is always difficult"
1601864909.0|worldnews|SpaceAgeNomad|Communist, not socialist.  And as usual for americans, you guys are lumping an economic model and a model of governance into one, which China does not.
1601864909.0|worldnews|blahblahrasputan|Are you guys not getting hammered by smoke? We were up in Vancouver on the weekend. Not as bad as a few weeks back but it got to moderate risk...
1601864907.0|worldnews|HeavenSmilesToo|I need to know what these games are...for research purposes
1601864904.0|worldnews|soiledsanchez|It’s called revolution, the only reason it’s still like this is because we are too stupid and complacent in our pathetic lives
1601864894.0|worldnews|LUHG_HANI|"Our UK one is being rolled out now. Thats the 2nd one after the first one failed and cost £16 million.

Its October, it could have been ready 3 months ago."
1601864894.0|worldnews|Windairio|"If you can find any other International source that claims ""Its  not Azerbaijan land"". Sure then you are right it has no value."
1601864893.0|worldnews|Chatotorix|For a sec I thought, wait, our kids are going to live 300 years? and then it clicked - no, it's the desert that's coming sooner than that.
1601864893.0|worldnews|ForgettableUsername|That’s no excuse!
1601864878.0|worldnews|MiltonFreidmanMurder|"Turns out authoritarianism is actually really useful in extracting profit from workers.

Capitalism."
1601864876.0|worldnews|JohnDivney|that's so cool! That's what I'm circling around to get, so what do you think?
1601864874.0|worldnews|infrequentia|Sadly they will make more money by clear cutting the land, selling the lumber, then re-growing plants in the clear cuts for palm oil. For the next x amount of generations will earn more than the offered 20 billion.
1601864869.0|worldnews|Gallijl3|Sorry, I said meta analysis but meant literature review.
1601864860.0|worldnews|creggieb|"Capitalism and communism are the main competing economic theories, and each has.... offshoots, that take the idea in a different direction. So when someone says capitalism is bad, and stops there , it is perfectly reasonable to assume they are promoting communism.

I live in Canada, a capitalist country with socialized  medicine, and other assorted social programs.  Still a capitalist country, and  IMO better than countries with a different economic  model."
1601864859.0|worldnews|blahblahrasputan|I was out camping near Chilliwack over the weekend and wondering why I could see this one massive bright star through the smoke that drifted up from the US... Amazing!
1601864856.0|worldnews|xMichaelLetsGo|That’s not real communism lol
1601864852.0|worldnews|fourthfloorgreg|It has several.
1601864852.0|worldnews|redpandaeater|I hate the light pollution I have around here.  Smoke hasn't helped either this summer.
1601864839.0|worldnews|filthyhabits|Better than nothing I guess.
1601864837.0|worldnews|cheesefondue|There’s a US politics joke to be made here
1601864833.0|worldnews|Elementium|"Is that what I saw the other night? I was looking at the full moon and saw a bright red star next too it. 

Was hoping maybe the Death Star was coming to destroy Earth."
1601864833.0|worldnews|Johnnadawearsglasses|You said it’s a meta analysis. Which it is not. I don’t dispute the conclusions but I tend not to mix position papers with studies in the same dialogue
1601864832.0|worldnews|wearelabrats|I mean, with overcycled PCR tests.
1601864831.0|worldnews|GrumpyDrunky|"Bud, “go start a grocery co-op to compete with Kroeger” is all I needed to hear.

One of us doesn’t know how this works, and it’s not the one with a finance degree, a CPA, and 11 years experience consulting at the Big 4."
1601864829.0|worldnews|i_hate_vampires|Renton...same
1601864822.0|worldnews|trollsong|So capitalism is just as bad and facist as communism got it.
1601864818.0|worldnews|IKillUppityNaggers|I'm talking about *real* communism as implemented in the real world, not Marx's fever dream.
1601864817.0|worldnews|crymoarrepublicucks|You clearly tried really hard on this hope you get your le reddit awards <3
1601864817.0|worldnews|tapvelik|"Seems like it was the Transcaucasian federation fighting out over who gets which part of that region. And then the two independent republics that ensued couldn’t agree. And then the reds came in. It’s far from clear cut. 

https://en.m.wikipedia.org/wiki/Azerbaijan_Democratic_Republic#/media/File%3AMap_of_the_Azerbaijan_Democratic_Republic.png

https://en.m.wikipedia.org/wiki/Azerbaijan_Democratic_Republic"
1601864808.0|worldnews|No_Class_3520|The current path will change nothing so
1601864807.0|worldnews|tr14l|Hey England, tag, you're it
1601864799.0|worldnews|AmputatorBot|"It looks like you shared an AMP link. These should load faster, but Google's AMP is controversial because of [concerns over privacy and the Open Web](https://www.reddit.com/r/AmputatorBot/comments/ehrq3z/why_did_i_build_amputatorbot). Fully cached AMP pages (like the one you shared), are [especially problematic](https://www.reddit.com/r/AmputatorBot/comments/ehrq3z/why_did_i_build_amputatorbot).

You might want to visit **the canonical page** instead: **[https://www.theguardian.com/world/2017/may/17/erdogans-bodyguards-in-violent-clash-with-protesters-in-washington-dc](https://www.theguardian.com/world/2017/may/17/erdogans-bodyguards-in-violent-clash-with-protesters-in-washington-dc)**

*****

 ^(I'm a bot | )[^(Why & About)](https://www.reddit.com/r/AmputatorBot/comments/ehrq3z/why_did_i_build_amputatorbot)^( | )[^(Summon me with u/AmputatorBot)](https://www.reddit.com/r/AmputatorBot/comments/cchly3/you_can_now_summon_amputatorbot/)"
1601864799.0|worldnews|Jerkstore911|Quebec, I assume. You know, the other nation.
1601864796.0|worldnews|bleepbeepclick|"I remember on my birthday several years ago,... at my own birthday party, ... with work colleagues....  


I offered to buy a middle-manager type person a drink,... ""I'm sorry I don't associate with the help.""

&#x200B;

It made me feel like shit at the time. 3 years later when I was their boss, I would remember it  anytime they wanted special treatment though..... I didn't hold I grudge, I just wouldn't bend the rules for them."
1601864791.0|worldnews|breedofgoodness|I agree. It’s not convenient to wait to charge where as if you’re on a long trip in a hybrid or gas/diesel you can just stop and fill up. I understand it’s not completely flawless. I just meet a lot of people who are against it for political reasons.
1601864790.0|worldnews|junkcrapdoll2|"Without proper moderation, social media aren't the best place to hang out.

And also users need to moderate themselves. There's no need to rush posting your latest food and vacation spots to climb up the social media's hall of fame."
1601864787.0|worldnews|CWanny|Add another zero to that.
1601864787.0|worldnews|LexPlex9000|"That's still wishy-washy, and was done without the President so as to avoid embarrassing him in front of his authoritarian buddy, Erdogan

Remember when [Turkish government thugs beat up peaceful American protesters on American soil](https://www.google.com/amp/s/amp.theguardian.com/world/2017/may/17/erdogans-bodyguards-in-violent-clash-with-protesters-in-washington-dc) for daring to question Turkey's use of ISIS to try to genocide the Kurds of Syria, and Trump said absolutely nothing?"
1601864776.0|worldnews|quantum_ai_machine|National territory in Europe or North America. Even overseas islands don't count.
1601864772.0|worldnews|captbz13|Oh no! Ronan warned us about that....be careful out there Harry.
1601864763.0|worldnews|75percentsociopath|I dream of America having social housing like in Vienna. I don't understand this home ownership majority of income on mortgage bullshit.
1601864751.0|worldnews|Primordial_Owl|Very apt comparison, bringing up something that happened centuries ago. A totally valid compariaon indeed. /s
1601864750.0|worldnews|Gallijl3|"I didn't say they did a statistical meta analysis.  They performed a literature review and reached the same conclusion I did with the information you provided.  The existing evidence is weak, but there is some evidence to support the statement that children are less prone to spreading the virus than adults.  I think this is generally accepted to be true anyways, but that's a much different conclusion than saying ""children don't really spread it at all"", which is pretty much what this telegraph article wants you to believe."
1601864749.0|worldnews|cardorm|He's not just a dick, he's also a sociopath!
1601864739.0|worldnews|Agouti|Turkey is *barely* part of NATO. They had their order of F35s cancelled on them because of concerns over the current leadership and its ties with Russia.
1601864735.0|worldnews|BigFitMama|"Violence used to be linked to: 

Penny Dreadful Novels
Bicycles
Radios
Comic Books
Toy Guns
Action Movies and TV (liked rated G ones)
Action Figures
Cartoons
AD&D
Roller Skates
Malt Shops and Ice Cream Counters
Swing Dancing
Jazz
Soda
Sugar
Women learning

And on and on - Brit kids getting radicalized by the same thing that adults worlwide are getting radicalized.

Because people have too much free time, not enough resources, and are looking for a place to direct their anger."
1601864728.0|worldnews|Sirbesto|"It is not just a tool, when it is designed to be as addictive as humanly possible.

Envy via glorified online database? Yeah, that sounds mentally healthy."
1601864726.0|worldnews|Temetnoscecubed|"It used to be easier.  

In the past you created a cartoon character with ridiculous views and the most stupid comments, and you acted like your chosen target.  Everyone would understand and your target would be embarrassed and annoyed by the portrayal. 

Today, the characters with the most ridiculous views and most stupid comments are embraced and copied by ""your chosen target"".  

In the past if you called someone corrupt and that their friends are all racists, they would distance themselves from the accusations.  

Now they flaunt their wealth, fire a ton of employees and have a party with known criminals and they themselves post it on social media.  

It does take a lot of work to troll the high and mighty."
1601864724.0|worldnews|stepheaw|It’s not fair those businesses and livelihoods are destroyed while others can stay open. It’s about personal choice but the government is saying these businesses will live and these businesses will die is just not right. There will be no coming back from this for many.
1601864723.0|worldnews|Deadeye_Spider|"*crickets*

what now?"
1601864723.0|worldnews|cystocracy|Not going to accomplish the same thing at all. The amazon is a unique ecosystem, once parts of it are destroyed you cant just make a new one in Montana, it doesnt work that way.
1601864715.0|worldnews|theseventhB|:)
1601864700.0|worldnews|but_but_ok|no idea, but our government invaded Iraq basically for no reason...refusing aid to protect something the entire world needs is not a smart move
1601864696.0|worldnews|WhenRomansSpokeGreek|"COVID is a good simulator for the inevitable alien invasion

The current trial run has shown interesting results"
1601864693.0|worldnews|Annihilate_the_CCP|">statism is different than socialism

Irrelevant to my point

>(though totalitarian regimes LOVE to mask things as communism/socialism)

Which ones?"
1601864690.0|worldnews|spaghettiwithmilk|You get a system that collapses and leaves an authoritarian who forces capitalism because it's obviously the system that works.
1601864689.0|worldnews|protoopus|evil has always existed.
1601864685.0|worldnews|crymoarrepublicucks|Because retards vote them in.  Seems pretty straight forward
1601864680.0|worldnews|Afinef|Five years out from 98 for a couple of five day allotments
1601864680.0|worldnews|hereagain1011|Happy cake day!
1601864678.0|worldnews|bookadookchook|Good heavens, that's true. What could it mean? Why did he write that?! Ahhh, so puzzling.
1601864676.0|worldnews|Goldenwaterfalls|A quiet bit? You mean like a quiet place? I live in a weird mix of assholes and cool people.
1601864674.0|worldnews|Bobhatch55|No, no. I’m sure it will be Exxon and Shell engineers. If there are martians there we need a reason to start a war!
1601864671.0|worldnews|Papuluga65|Sorry, but do you have more information on that? Thai people really wanted to learn of his whereabout.
1601864669.0|worldnews|happyhappypeelpeel|"IOW you don't know how any of this works and you don't care to, but you are fixated on billionaires as the beginning and end of both the problems and solutions. Amazing how out of ""bankruptcy is bad, do the numbers yourself, not every company is Microsoft (most aren't, shocker!), and nothing is stopping you from launching a business"" you pulled out ""oh you worship billionaires."" You're literally hallucinating viewpoints I don't hold to avoid having to challenge your worldview.

Not subscribing to a willfully ignorant POV just so I can jerk myself and my friends off about how righteous we are is not the same as worshiping billionaires. Maybe you'll figure that out one day. You are literally patting yourself on the back for being ignorant. Who's got the religion here again?"
1601864666.0|worldnews|Johnnadawearsglasses|The taxes are low. The costs are astronomical though
1601864664.0|worldnews|Jerkstore911|Heard this one a couple times now.
1601864659.0|worldnews|retshalgo|Nah, people hated it for sure because it was bad for the working class in certain industries while also being pro-big business. But it’s also really important for US standing in the world economy.
1601864658.0|worldnews|successful_nothing|Ok fine, what is your point then? That anyone can speculate about the possilbilities of a situation that never happened? I agree with that, that's why I pointed out the original person's comment was speculative and not fact.
1601864657.0|worldnews|joeythekidisamon|"Politicians ruin society. No man in public office or leadership is out to help the ""people"". The reality of this shit world is too hard for people to accept. Instead we are here bickering about Blue or Red like it makes any difference. All people at the top of the Pyrmaid only want to stay at the head while crushing those at the base to maintain their life. All the government agencies and media used as tools by the powerful to prop up their goons. It's sick how we live. I wish we could live in a society that Taps into everybody's potential without fucking slave wages and billionaire CEO's. But there is no other way to exist at this point. Every government is the same."
1601864649.0|worldnews|gmz_88|I’ve seen reports that it was a young woman that was attacked. A cowardly Nazi attacked her from the back with a shovel.
1601864646.0|worldnews|Avocado_Esq|"My province is averaging between 100 and 150 new cases per day. Restaurants are open with limited capacity. Casinos are open (somehow? I'm not a big gambler and touching things that have been touched by people I've seen in casinos was never something I wanted to do).  Breweries are serving cheezies and bagged snacks so long as you stay six feet away from other patrons.

Nightclubs and anywhere with a liquor only license are closed. The owners are stressing and have applied for federal assistance, but most everyone is okay with it, because of how low or transmission rate is. The biggest thing I'm seeing is that a lot of nightclub owners are former oil and gas guys who got let go during the downturn and somehow blame oil prices and Covid on the Liberal government. They don't have the skills to consider that perhaps their fiercely independent oil and gas employers didn't know the market well enough to forecast downturns."
1601864644.0|worldnews|10guymichael|Yes it’s a real comet. You can’t look it up on the free space maps but it’s on the paid ones and there is a guy on you tube who claims it has biblical ties revelations 12 and  to Armageddon. Something about the verse description only making scents in Astrology within the constellations. Freaky shit. He talks weird and it doesn’t all make scents but I think there is some crazy truth going on with it.
1601864639.0|worldnews|cystocracy|"Nothing wrong with sanctions on countires who we believe are a threat to the world, whether by environmental means or otherwise.

Now of course, by this definition, the USA should be sanctioned too, and of course it certainly should be, but unfortunately there's no one big enough to do that."
1601864638.0|worldnews|crymoarrepublicucks|Yes.
1601864629.0|worldnews|junkcrapdoll2|My half full glass mentality says it's a comedy.
1601864614.0|worldnews|hawkeye315|statism is different than socialism (though totalitarian regimes LOVE to mask things as communism/socialism)
1601864611.0|worldnews|mysweetjenny|Let’s shut down the economy and then blame it on capitalism. 🙄
1601864611.0|worldnews|shitheadsteve1|"""American's haven't noticed""... these kind of statements on reddit are always great to see. lol"
1601864609.0|worldnews|FireMammoth|you're spot on in my case
1601864606.0|worldnews|QB145MMA|Strange kids/teenagers are a hot bed as carriers and trust me...their personal hygiene is almost nonexistent.  I’ve taught students that lick their fingers, use school lap tops, touch the keys screen, don’t wash their hands, just yuck all together lol
1601864604.0|worldnews|doneanddead|"> Whoever puts the US in the same basket as Saudi Arabia, China or Turkey is a fucking moron. Disregarding the political mayhem, workers rights, environmental policies and freedom of speech, etc. are all there.

Yeah, you're right. A random kid in the Middle East doesn't worry about Chinese drones bombing them to death and China doesn't have a few hundred thousand dead Arabs as part of its country's history in the past 2 decades. It does a disservice to China when you compare their record to America :( :( :("
1601864601.0|worldnews|Beldor|Wait is this a bribe. Hey what... what’s going on?!?!?
1601864592.0|worldnews|sevenlayerbeandip|"I actually have a crippling phobia of driving because I'm afraid that I might hurt or kill someone so I understand your view point about Boushie and other drunk drivers but I wish there could have been a better solution.

That's a shame that response time is so few and far between it probably leads to a lot more desperate actions and responses on victims parts out of fear of someone not getting there in time to help.

Working on trains suddenly sounds a lot less fun lol still having never been on a train I can cling to the romantic notion of riding a steam engine and watching the world amble by! I wonder why working on trains robs people of their filters though? I'm sorry."
1601864590.0|worldnews|Suibian_ni|What's the evidence for that? How many coups and invasions have the Chinese instigated in the developing world? They seem quite capable of getting what they want without resorting to American methods.
1601864582.0|worldnews|ThatGoddamnLeftist|I’ve been there. Not the fist bumping part, but dating women out of my league physically that are terrible human beings, and me losing interest *fast*. Good on you.
