1601865964.0|worldnews|mrinvertigo|We all must do our parts.
1601865961.0|worldnews|gregorydgraham|"Fuel tax? Amateurs!

Ban petrochemical extraction."
1601865955.0|worldnews|manny-t|"Your getting upset over nothing 

I’m still looking up the info you suggested"
1601865943.0|worldnews|Supernova008|My vote in next election (election in which I'm gonna vote for first time) is going to opposition party else BJP will turn India into authoritarian nation.
1601865935.0|worldnews|DiamondSnowOnPluto|Grayhounding is nothing new. Every city should know to ship them right back to where they were sent from.
1601865930.0|worldnews|penemuel13|Believe me, I’m in awe of the accomplishment and wish we had a leader who would have even done half as much. Instead, we have morons who don’t even understand wearing a mask isn’t to protect *them*, who don’t even *care* if others get sick, and a president* who is so damned irresponsible that he held a superspreader event and is now in the hospital himself. We have people who went to ‘reopen the economy’ protests with signs that literally said ‘sacrifice the weak’. It’s horrific how irresponsible and selfish so many of our citizens are.
1601865923.0|worldnews|thecummaster3000|A severely under equipped vietnam took on the usa. I think china would be able to do just fine.
1601865921.0|worldnews|ParkJiSung777|">Biden's intention to end up offering $20 billion to address keeping the Amazon safe is a very different scale and focus than what you are attempting to claim is the same move.

Different scale but money itself isn't going to make the current Brazilian administration agree with us.

>I see it as the wealthy countries trying to make it fair that they are telling Brazil not to treat they environment as they once did for profit.

Sure that's a fair interpretation as well but again, that's not going to change the effectiveness of his plan.

>As to you having no idea what Biden actually proposed, it doesn't surprise me that others have chosen to down vote since it goes over this stuff immediately in the article.

He's very vague, probably purposefully. What does ""countries of the world mean""? Does that mean large Brazilian trade partners like China? If so, how he's going to get them on board since they have no incentive. Asking these questions show that Biden's plan is almost illogical.

>Finally, again I ask what are we supposed to do if not economically incentivise Brazil to do the right thing? I don't think it's reasonable to use military force and while culture is referenced as a source of power, I don't think a diss track is going to convince Brazil to change their actions.

Diplomatic force from regional actors is what's important. Empowering relevant local actors in the Amazon is important. All of those don't require giving $20 billion and is probably more effective."
1601865920.0|worldnews|deathtoll1000k|Where did you see that
1601865919.0|worldnews|IKillUppityNaggers|"It's pretty much a meme at this point that you commies refuse to take responsibility for the failure of communism **every single time** it has been tried. I'm sure the [44th time](https://en.wikipedia.org/wiki/List_of_socialist_states#Former_socialist_states) will be the charm.

Call me when you morons figure out how to implement it without everyone starving to death under a totalitarian nightmare regime. I won't be holding my breath."
1601865914.0|worldnews|CaptainEasypants|Why don't they build the whole airplane out of the black box material!!!! And what's the deal with airline food?
1601865895.0|worldnews|Zomaarwat|It's called doublethink.
1601865894.0|worldnews|dunker_-|What is he suggesting, feudalism?
1601865876.0|worldnews|paxmlank|"*Personne ne s'en fout* would already been *Nobody doesn't care.* I was thinking that adding *pas* at the end would fix that, but it would ""have to"" be *Personne ne ne s'en fout pas*, which is non-grammatical, so yeah, *Tout le monde s'en fout* is right.

Ceci demontre que le francais et l'anglais ne sont pas similaires, un probleme avec lequel je lutte souvent."
1601865871.0|worldnews|grumd|So fewer new ideas and businesses will be created, but those which will, will succeed more often. Probably results in less technological advancement but better equality and life satisfaction among people.
1601865868.0|worldnews|muttonmilk|i thought i was seeing star people floating in low orbit
1601865865.0|worldnews|WaterPollo|Jailing anyone who says anything perceived as negative about Erdogan.  In fact they'll jail your family members if you're out of the Country. (See Enes Kanter)
1601865864.0|worldnews|CaptainEasypants|And luckily for aus we're in a la Nina which should bring rain so we don't get a repeat of last fire season for at least another 2 years. Go us!!! Also our government has greenlit a gas based recovery to get us out of this economic recession so that 2 years is no joke. We are fucked!
1601865853.0|worldnews|FredFlintston3|You can check my history and see I made the same complaint when the BBC published the phrase. Got called all kinds of names from, let's say, questionable people swearing it is acceptable. Its more than cringeworthy.  Keep fighting the good fight! We are one of the FEW who understand.
1601865838.0|worldnews|joseflamas|Lol I just posted about this hahahahaha
1601865834.0|worldnews|Clemen11|Oh that explains what I saw the other night! Beautiful full moon with a bright red spot near it!
1601865833.0|worldnews|Stealthmagican|Yes only bad thing he directly did was assassinate the dear Iranian General
1601865827.0|worldnews|Mikimao|"> So when someone says capitalism is bad, and stops there , it is perfectly reasonable to assume they are promoting communism.

Actually it isn't.  If you have a question about a position you should ask and clarify it rather than assume and be incorrect.  That is the most basic step you could possibly take.  It isn't correct to assume that someone is rooting for some team just because you may be.

What you hit on is much closer to my position which is there are definitely things capitalism does to benefit us, and I would even go so far as to say it's sort of intrinsic to life in general, it doesn't account for the fact it has to be modified in order to get better results.  If the economic model dictates throwing human lives at it to keep making money for cooperations, it isn't serving us well as a people.

I live in the US, and some how I am willing to bet you wouldn't go more capitalistic than Canada unless you have a significant amount of money."
1601865825.0|worldnews|Fiddler-4823|Yet fukktard democrats rejected a few billion to protect the United States from illegal entry at our southern border.
1601865824.0|worldnews|kat-mandoo|I love the pope so much !!! 💞
1601865820.0|worldnews|Fredstar64|You should post this on /r/geopolitics honestly, not much quality discussion there on the most interesting geopolitical conflict of our time.
1601865820.0|worldnews|Ginger-Nerd|"I am certain... there is no doubt.

You are quibbling over fractions of a percent chance,
The odds that you’re right, are so astronomically low...  to the point, you look kinda like a fool for suggesting it. 

Is there a chance sure.... in the same way there is also a chance you would win the lottery by being struck by lightning in the middle of a shark attack."
1601865818.0|worldnews|Hubris2|It is a combination of good fortune, good leadership following scientific advice, and good compliance to the rules - that we find ourselves able to remove restrictions....comfortable that the people we meet in the community are free from the virus.
1601865815.0|worldnews|Actual-Scarcity|Yeah I've got (many) problems with the church, but that is a weak criticism.
1601865815.0|worldnews|get_off_the_pot|They gave more than diplomatic support. They also provided food aid to them in Thailand and military aid after they were deposed by the Vietnamese. As if diplomatic support wasn't bad enough, the US was far from trying to save an oppressed people.
1601865809.0|worldnews|blackreagan|"Looks like they need Biden's proven leadership to provide a light in the darkness and a steady hand during the crisis. 

Or a pandemic is not so easy to manage."
1601865808.0|worldnews|raven080068|Trolol
1601865806.0|worldnews|thecummaster3000|Thanks for focusing on the  irrelevant details. I was referring to East Asia. places like india has huge crime rates just like the west.
1601865798.0|worldnews|TypicalPakeha|"I saw it last night and was like, wtf is that? I actually sat there for a couple of minutes making sure it wasn't an asteroid pointed straight at us lol. When it didn't get bigger I figured we gucci

I also wondered if it was a supernova, then gamma ray burst crossed my mind, so I decided to go to sleep instead haha"
1601865782.0|worldnews|Kanexan|Distributism economically is like Thomism philosophically or Latin linguistically; the Church does not strictly *require* it, it's simply something that (in theory) works *very very well* with a Catholic framework and worldview. A welfare-state capitalist model that aligned with Catholic social teaching would be perfectly supported by the Church.
1601865777.0|worldnews|taraist|Ah yes, so making everyone do what anyone responsible has been doing for half a year.
1601865769.0|worldnews|StubbornElephant85|I moved from Michigan where everything was closed to a small town in Illinois where everything was open (July). The Governor just issued an order last week that everything in our county plus a few others need to close, and all stores require masks. The town council met and said they are not following the order.
1601865766.0|worldnews|randompersonwhowho|To fight in the homeland right?
1601865757.0|worldnews|bigsquirrel|"I’d need to see more of what was written. Cambodia and Vietnam have similar laws.  Usually it’s got to be pretty egregious for the police to follow up on them.  It’s really an apology and a fine. It’s like American sentencing, in some states you “could” be sentenced to jail time for jaywalking, obviously that very rarely or never happens.

I’m not entirely against these laws in careful moderation although I’m not sure how that would be accomplished .  There’s so much threatening happening to businesses using reviews as a lever it’s kind of sickening and unfortunately business owners largely have very little they can do about it."
1601865748.0|worldnews|DatBingBong|"Your comment that I first replied to basically stated that it is impossible to know what would have happened. This is true, and I’ve always agreed that it’s true. The fact that I am making an educated guess should serve as an admission that I obviously don’t know for a fact what would’ve happened. 

My first comment was basically meant to be read as “true, but we can make an educated guess” and your reply was no we cannot make an educated guess.

My point was entirely petty, still correct tho"
1601865746.0|worldnews|Serena25|Bars weren't already shut there?!
1601865743.0|worldnews|JohnGabin|"You can find corruption everywhere. That's not the point. Cahuzac was found guilty, tried and condemned,for tax evasion..

Chirac, Pasqu, Balkany and almost all the members of the party were involved in criminal activities.
That was a system. ."
1601865741.0|worldnews|AutoModerator|"Your submission has been automatically removed pending manual approval because your account does not meet the minimum karma or account age requirements of /r/worldnews for submitting from an uncommon domain. 

If you are new to reddit, we suggest you read

* [reddit 101](http://www.reddit.com/r/help/comments/2bx3cj/reddit_101/)

* [How reddit works](http://www.redditblog.com/2014/07/how-reddit-works.html)

* [The rules of /r/worldnews](http://www.reddit.com/r/worldnews/wiki/rules)

You may also want to review the [Reddit guidelines regarding spam](http://www.reddit.com/help/faq#Whatconstitutesspam) and the [wiki on self-promotion on reddit](http://www.reddit.com/wiki/selfpromotion). 

*I am a bot, and this action was performed automatically. Please [contact the moderators of this subreddit](/message/compose/?to=/r/worldnews) if you have any questions or concerns.*"
1601865738.0|worldnews|White-Obama231|How come?
1601865734.0|worldnews|anonymousgirrafe33|This why you dont take a nap in extreme cold environments
1601865726.0|worldnews|manny-t|"East Asian now huh! Very interesting as you started with Asia all together! seems like notice real quick that you had to narrow down who you would like to talk about. 

But ok I’ll look into your narrowed down scope here"
1601865726.0|worldnews|Zolotoy_I|"A signal of war

Finally I get to fucking die"
1601865721.0|worldnews|Kqthryn|"You'll stand up for pedos but turn your nose up and call a woman narcissistic for defending herself against trolls.
..Who were harassing her for something she couldn't control? Her genetic disorder that she couldn't control?  

Honey pick a struggle, it ain't a good look."
1601865715.0|worldnews|BoopDoggo|Good luck with that
1601865714.0|worldnews|EnriqueWR|It doesn't seems like Trump cares as much about Bolsonaro as Bolsonaro is thirsty for Trump, but your elections over there have ripples in here.
1601865712.0|worldnews|kkkkkk696969|World seems to revolt around Race and religions base conflicts.
1601865710.0|worldnews|cystocracy|"The united states already invests a shit ton in forest conversation. If you want ill go dig up the link for you, but the Country actually has more forest cover now than at the beginning of European colonization.

While the amazon is an area of the world in serious danger right now. If the carrot won't work, use the stick. Punish Brazil diplomatically and economically if they refuse to be stewards of the environment."
1601865705.0|worldnews|asian-zinggg|Idk much about Brazil, but the two things I know now are that they suck ass just like America at handling Covid and that their president hates the environment. Seems like a shit show over there.
1601865702.0|worldnews|TruBlue|Pot/Kettle!
1601865698.0|worldnews|moosiahdexin|"This is fine. A candidate Biden making offers of 20 billion to world leaders..

But president elect trumps staff can not discuss foreign policy with Russian foreign affairs officials.

It’s like you’re not even trying to hide the blatant double standard :)"
1601865696.0|worldnews|CaptainEasypants|Pffft is renewables are so great why aren't they at all the fundraisers buying up votes like the rest of the energy sector?!?!?!? Checkmate libtard!
1601865690.0|worldnews|Vaperius|"> congo has huge tropical forests on the same latitude of the amazon,

And? The Congo jungle is sustained by the *exact* same systems as the Amazon FYI. The climate is there *because of the Jungle* not the other way around."
1601865689.0|worldnews|anonymousgirrafe33|This why you dont take a nap in the antartic
1601865677.0|worldnews|DunkFaceKilla|But if they don’t?
1601865674.0|worldnews|roboq6|">Spreading your geopolitical influence is not the same as fighting to protect your ""Motherland"" 

Yes, but I was telling about other kind of war, namely kind of war where you literally protect your country.

> and just fighting in a war does not make you a hero

If you're figthing it to protect your Motherland and your chances to survive it are very slim - you're an altruist. If you willingly sacrifice your life to further protect your Motherland, you're not just an altruist, you're a **martyr**. Like that Russian editor."
1601865674.0|worldnews|happy_mechanism|Revenue.
1601865673.0|worldnews|Xerxesthegreat1|Or as he is colloquially know, Jar Jar
1601865670.0|worldnews|thecummaster3000|Chinese have a first-hand account of the adverse affects of pollution on health. Saying they're just reducing pollution to make themselves look better for white people is fucking stupid, so Idk which ass you pulled that random thought out of
1601865662.0|worldnews|SUMBWEDY|"No america did not have the equivalent lock downs to New Zealand.

Our first lockdown was the most restrictive lockdown on the planet at that time, we locked down so hard in fact the first 8 days of the quarantine have been ruled illegal by our supreme court.

Seriously nothing other than largest 2 supermaket chains and pharmacies were open (even small family run supermarkets were not allowed to be open)."
1601865658.0|worldnews|I_am_sloww|But let’s keep shutting down for a fucking cold. Soon there won’t be a single entertainment business left
1601865654.0|worldnews|retropieproblems|There isn't really a difference between cro magnon and Homo sapien to warrant a distinction. Cro magnon is just what we call modern humans who developed alongside neanderthals to distinguish them apart.
1601865651.0|worldnews|bigchicago04|I was gonna ask why his first name is always different.
1601865644.0|worldnews|DoktorLecter|fuhhh
1601865642.0|worldnews|Shazaamisreal80|China is the biggest threat to the entire world at this point, they have their sights set on world wide takeover and domination . Thanks to Obama and his cohorts who should be arrested for treason, he almost completely sold out the U.S to China. If Trump did not win I don't know what kind of hell we would be living in today. He is simply just out for OUR best interest. He wants to see America succeed and thrive, like we were before the man made virus came about and nearly destroyed our economy. I truly don't understand why most Americans can't see that. He's not a racist, never was. He is not in office for the rich, most rich people in this country despise him. He is 100% for Americans of any color , creed or religion. Americans who are about working hard so that they can support themselves. That is the American dream and it's a beautiful and truly basic thing.
1601865633.0|worldnews|Actual-Scarcity|Judging by their comment history, this person is likely a lawyer or a law student. Why do you think they are a troll?
1601865631.0|worldnews|Imperial007|"NZ went into Level 4 lockdown, with among the highest restrictions in the world, and then eliminated the virus from the community. We then had around three months, 100+ days, of zero community cases being reported. During that time we had full stadiums, packed bars and restaurants, reopened cinemas, and schools fully open as normal. Our health system never came under strain. And domestic tourism skyrocketed as a campaign designed to promote our local tourism operators was made, to enjoy our backyard without the usual traffic of international visitors.

And when a second wave hit, only Auckland had to lock down again. The rest of the country kept moving, albeit with social distancing required at Alert Level 2. Now all areas of the country are back to normal again, and we get to enjoy those freedoms all over again."
1601865628.0|worldnews|blahblahrasputan|We had a very sunny Saturday so maybe that's why... Seemed better today but I don't know if that's the clouds dissipating it or hiding it...
1601865626.0|worldnews|DiggerW|">I take solace in the fact that there are probably multiple other EU countries who would suffer a similar result if asked the same question. 

Or would have, anyway, and especially If they were equally told the referendum was non-binding"
1601865617.0|worldnews|The_Apatheist|Unless you are Albania
1601865611.0|worldnews|Ginger-Nerd|"It’s virtually certain that for those 100 days NZ had eliminated it. 

It’s pretty easy to see with modelling and the data; how long it can remain undetected in a community and IIRC, it’s about 2 weeks to be virtually certain (think like 99.99% sure; every day after that, add more 9s) we had 100 of those 9s

10 days post last case they are 95% sure it’s not in the community.

100 days it’s like 99.9999% sure it wasn’t in the community. 

It’s not sus it’s odds and stats.  

If you want more proof (although you shouldn’t need it- the modelling was pretty much in agreement) 

You can look at the genomic testing; which shows the previous cases were significantly genomicly different from the most recent cases/clusters."
1601865611.0|worldnews|--h8isgr8--|Haha no kidding I saw a damn hawk sized mosquito the other day. I swear they get bigger every year. People need to chill out bringing stuff like that in. We have a nice out break of pythons and boas in the southern part of the state.
1601865610.0|worldnews|Slight-Low-6628|Yes, we need science based large scale reforms, but if you are backing those kinds of reforms, like fuel taxing, you are a fucking hippie to some ignorant dipshits. Any kind of protection of earth is somehow bad in some people's minds.
1601865602.0|worldnews|Sabot15|Hey, Americans get to find out where Armenia is located.   Seems like we should be able to teach geography in grade school, but I guess starting wars is a good way to teach geography as well.
1601865588.0|worldnews|TruBlue|Must be an election coming up!
1601865575.0|worldnews|ChornWork2|so 20yrs from now?
1601865559.0|worldnews|VenomousTwat|"A larger population should make it EASIER to implement single payer healthcare. The law of demand says sourcing medical supplies in larger quantities will result in lower per-unit cost. Law of averages means a large population will be less vulnerable to year-by-year changes in GDP vs total cost of care. It is not like all of the healthcare infrastructure needs to be uprooted and rebuilt across the country. We already pay more per capita on healthcare than anywhere else BY FAR and our life expectancy is one of the worst in the developed world. It can’t get worse, it can only get cheaper. Read up, the data is all out there. 

https://ourworldindata.org/the-link-between-life-expectancy-and-health-spending-us-focus"
1601865534.0|worldnews|Dinklemeier|Oh, haha, I never actually even thought of that.
1601865517.0|worldnews|WildGrit|It came in from overseas when someone skipped quarantine. Zero cases in a country of Five million is beat
1601865507.0|worldnews|une-transaction|"""Personne ne s'en fout pas"" is not something you would really say since it's a double negation of sort but it would translate to ""Nobody doesn't care"" which is somewhat the contrary to ""no fucks given""."
1601865505.0|worldnews|ChornWork2|"I'm talking about the reality of solar which, it is producing power after people go to work and before they come home.  For solar to be what charges cars, you need infrastructure to charge when they're at work (weekdays) and also when at home (weekend).  That's expensive. Or you need batteries, but that means effectively 2 sets of batteries are needed for cars (one on the grid to time shit, one on the car).

Small scale solar is incredibly inefficient relative to utility scale projects.  Doesn't make sense to build on your home, let alone your car."
1601865499.0|worldnews|hazjosh1| Well I mean wasn’t their like a catholic manifesto that is kinda of communism but not?
1601865490.0|worldnews|Cool_Cooler_Coolest|Brazil has 25% of the entire country are preserved, not 25% of the forest. US has less than 3%
1601865486.0|worldnews|thecummaster3000|look at the crime rates of all east asian countries. Ask any female tourist how she feels traveling in China alone vs Europe/USA alone. No one in China is afraid to go out at night. The same cannot be said for europe/usa/australia.
1601865486.0|worldnews|discountErasmus|You might be surprised. They usually don't break it out, but in Australia where they do, the Medicare tax is 2%.
1601865478.0|worldnews|McNultysHangover|They turned into werewolves and fought vampires obviously.
1601865476.0|worldnews|blusky75|Then submit a new post about it. Don’t hijack comment a thread that has nothing to do with the topic.
1601865473.0|worldnews|penemuel13|I wouldn’t let us in, either...
1601865470.0|worldnews|AmputatorBot|"It looks like you shared an AMP link. These should load faster, but Google's AMP is controversial because of [concerns over privacy and the Open Web](https://www.reddit.com/r/AmputatorBot/comments/ehrq3z/why_did_i_build_amputatorbot). Fully cached AMP pages (like the one you shared), are [especially problematic](https://www.reddit.com/r/AmputatorBot/comments/ehrq3z/why_did_i_build_amputatorbot).

You might want to visit **the canonical page** instead: **[https://www.sun-sentinel.com/coronavirus/fl-ne-coronavirus-florida-bars-adopt-food-service-20200905-vvdy7zmnwfdyxdpl5pshrrg7qe-story.html](https://www.sun-sentinel.com/coronavirus/fl-ne-coronavirus-florida-bars-adopt-food-service-20200905-vvdy7zmnwfdyxdpl5pshrrg7qe-story.html)**

*****

 ^(I'm a bot | )[^(Why & About)](https://www.reddit.com/r/AmputatorBot/comments/ehrq3z/why_did_i_build_amputatorbot)^( | )[^(Summon me with u/AmputatorBot)](https://www.reddit.com/r/AmputatorBot/comments/cchly3/you_can_now_summon_amputatorbot/)"
1601865469.0|worldnews|FoxPowers|we already had those lockdowns for months.  but when your dealing with 330million people, the contact tracing gets mighty tangled in a hurry.
1601865456.0|worldnews|ImPinkSnail|"If this turns into half of the shit show it did when American cities tried to shut down bars you better get a shovel and invest in hotdogs.

https://www.google.com/amp/s/www.sun-sentinel.com/coronavirus/fl-ne-coronavirus-florida-bars-adopt-food-service-20200905-vvdy7zmnwfdyxdpl5pshrrg7qe-story.html%3foutputType=amp


> Bar owners whose businesses were shut down in the fight against COVID-19 are now offering food so they can reopen — but they’re going about it in starkly different ways. In Plant City, the PaddyWagon Irish Pub said it did little more than spend $13.99 on a Crock-Pot so customers can chow down on hot dogs."
1601865450.0|worldnews|dekd22|Literally every thread on this sub is shitting on the US and Americans in some manner
1601865448.0|worldnews|Armchairbroke|And?
1601865438.0|worldnews|slightly_above|Remindme! 9 days
