1601864059.0|worldnews|shaker7|You love to see it
1601864057.0|worldnews|itninja77|Our biggest issue isn't from outside the country.  Yes, it came in at the beginning, but when way too many morons run around doing everything they can to not abuse even simple mask rules, what do you think is going to happen?  This entire Ioad of shit is on us (US citizens) and won't change until the utterly stupid  fools that follow the current administration stop thinking they know better than literally any doctor and actually abide by simple guidelines.
1601864057.0|worldnews|zombieofMortSahl|My vote counts less now than it ever has before.
1601864054.0|worldnews|slowmood|Love this thread. The discussion about China being fake communist is hilarious and right on.
1601864054.0|worldnews|thisispoopoopeepee|Also means the locals wont turn that land into farm land.
1601864051.0|worldnews|inkihh|But it's not super high, as is implied.
1601864042.0|worldnews|DuMaNue|It's a meme, I think from a taco bell commercial or something. Your friends are just quoting an internet meme.
1601864042.0|worldnews|CarnivalOfSorts| Will it be as big as the moon? Because people will believe that shit and retweet and share all over.
1601864039.0|worldnews|lamirg|"Im fully aware of the increased risks with increased meat consumption, especially processed meats, limiting those foods is ideal for health.

But i dont want to hear some redditor trying to virtue signal, pious vegans/vegetarians are insufferable."
1601864038.0|worldnews|Itsnotallaboutyou888|Exactly.
1601864034.0|worldnews|aprilized|except it's not in Quebec. If you're Catholic, you can show symbols like giant crosses in government buildings. They're such racist scum
1601864024.0|worldnews|BaconFairy|Same thing with Latinos.
1601864018.0|worldnews|GeneralMosquito13|I had already mentioned one comment above that the Khmer Rouge fell after their failed invasion of Vietnam. As well as the fact that the US gave some diplomatic support to the Khmer Rouge after they were removed from power. The fact that the US was fighting against Communists who murdered millions of innocent people was my central argument. Once again I ask, where is this supposed complexity causing me to be out of my depth?
1601864012.0|worldnews|Admiral-Tuna|I saw it the other night. Was quite bright.
1601864012.0|worldnews|MarkAndrewSkates|It means it's the first place with $25 minimum
1601864001.0|worldnews|CallyBreekTattie|you should probably stop using shitty ass chicken coops then ..
1601864001.0|worldnews|myspaceshipisboken|Eh I dunno, it's basically just capitalism with a little bit of long term planning thrown in. That's what you effectively get in developed nations that actually have a labor party anyway, only without all the costs associated with subjugating the population. And you have the tricky situation where those in power have a *personal* stake in established businesses without any real checks from the general population (same problem in the US) and if anything less of a check because of the whole subjugation thing.
1601863996.0|worldnews|Johnnadawearsglasses|"I posted one report that cited two studies. I could’ve posted 5.  What you have posted is not a study. It is a guidance document.  The only study I have seen that is cited as evidence of child super spreading is this study


https://www.jpeds.com/article/S0022-3476(20)31023-4/fulltext#secsectitle0025

Which actually has nothing to do with transmission and has been debunked as evidence of super spreading


https://fullfact.org/health/children-silent-super-spreaders-coronavirus/"
1601863995.0|worldnews|egvrawg7|"> Thats about right, being and indian i can confirm this is absolutely true.

Weird, I lived there and the main reason everyone drove is because they have AC/heat and drivers - if it's damn hot or cold, which is often. 

If you are middle-class and above you will have cleaning ladies, drivers, watchmen for your building, cooks, etc... often living with you. Businesses will have drivers and assistants/helpers/maintenance/chai-fetching guys... 

Think slightly-updated colonial mentality of Victorian era class-based living.

Unless it's late at night I've **never** heard of someone taking a car for safety reasons. Always for comfort. Although the trains and riks are often much faster, often by a lot, they are waaay less comfortable.

Women not going out to get food for lunch from the street stalls alone?! Man, that's not true at all. Every street and market is bustling with women. 

The times to be actually wary are late at night, rush-hour trains, and in crazy crowds for festivals.


Just FYI."
1601863993.0|worldnews|tapvelik|"The more you read about Crimea, the more the Russian position seems legitimate. That being said, the situation is a tad different. Either way, Azerbaijan has been sour since the autonomous oblast of NK decided to hold a referendum (without interference!!!) when the USSR collapsed to not join the new country of Azerbaijan. They went to war to deny the people independence and lost. 

Sure, the UN made up of nation states concerned with territorial integrity will usually support that doctrine. But what’s the right to self determination worth to you? The people living there have never wanted Azeri rule, not before nor after the USSR. 

The way to resolve anything is not by bombing the ethnic Armenians living there. Much less when the agression is supported by the nation state that succeeded the genocidal state of the Ottoman Empire (Turkey). Recipe for a disaster."
1601863985.0|worldnews|cut_that_meat|All able bodied men below 40 have been called into service on the Maginot Line effective immediately.
1601863984.0|worldnews|MsAntrophie|Random question, are you Australian? All of my Aussie friends use that quote all the time.
1601863981.0|worldnews|I_dont_like_sushi|Ai vem os animal e taca fogo na amazonia pra salvar ela dos soldados brasileiros malvados hahahahah
1601863980.0|worldnews|Bucketdweller|17%
1601863978.0|worldnews|inkihh|This doesn't mean anything. Cost of living is extremely high in Geneva.
1601863977.0|worldnews|Timoris|"Essentially

However, remember that Astrology paved the way for Astronomy."
1601863976.0|worldnews|Bewaretheicespiders|"Yep. We weren't only asking Trudeau to stop flights from China but from Iran and Italy too, from where a lot of the early cases came. Legault was at Montreal airport at least trying to organize some sort of screening, while Trudeau was calling stopping the flights a ""knee jerk reaction"""
1601863976.0|worldnews|liarliarlait|By Black people do you mean African Americans? Or Africans...
1601863975.0|worldnews|easyusername15|I went just outside and it's 10pm in Tallahassee, I didnt see anything :(
1601863968.0|worldnews|murster07|Stop defending terrorism you fucking cunt.
1601863967.0|worldnews|kev0521|"Does it matter? What ever ""extra"" they pay in taxes is saved by no having to purchase health,dental,vision, higher education , ect etc. Im considered middle class and would gladly pay an extra 3 pr even 4 % in taxes. I would still be saving money"
1601863965.0|worldnews|mehoff88|k
1601863956.0|worldnews|webby_mc_webberson|That's the thing. Then there's the people who cover the camera on their laptops because they saw that Snowden movie, but have 2 cameras on their phones that can capture literally everything else in their world and don't even think about it.
1601863944.0|worldnews|CaptainObvious0927|My job is to ensure my kids live a successful life, not to coddle their emotions.  That’s your job as a parent too.
1601863933.0|worldnews|_I_am_irrelevant_|Well, I don’t think you can claim any moral high ground when you generalized Sikh people far more than I have Muslims. In fact, I said nothing about Muslims, just that they have strayed from their source material and should just move on from it since the original material is very violent and radicalizing.
1601863929.0|worldnews|shdwprncss|Which is illegal and won't hold up in court if challenged, even in the US. You can't sign away your rights.
1601863923.0|worldnews|jellyjellyfisher|well that just turns into you can't make fun of anyone for anything, including the orange man etc, but i wouldn't make fun of someone for being poor either - but things like fat shaming should be okay if the person can change it
1601863920.0|worldnews|successful_nothing|I think you need to reread what I wrote because that wasn't my argument.
1601863919.0|worldnews|Lucifers-xtc|Dumb
1601863919.0|worldnews|CallyBreekTattie|not in my experience. where in the us are you referring to?
1601863918.0|worldnews|Gallijl3|Thanks, but this is a VERY small study and I don't put much stock in its findings.  Please visit the link I posted in my posts edit.  I think it's more of a meta analysis.
1601863917.0|worldnews|NihiloZero|"To some extent, and not with total transparency, that already happens.  That's effectively a lot of the result of soft power influence.  If a nation is getting getting sweetheart deal for some act of partnership/collaboration of a grand scale... you can bet that the leaders are getting some sort reward for it, at least indirectly.  At the very least, the absolute minimum, they're only going to be taking a deal that allows them to stay in power.  

And any smart wielding of soft power will allow the larger benevolent ""donor"" nation to have a longstanding positive relationship with the nation they're getting involved with and giving the deal to.  That will typically involve, at least, making the current leadership of the smaller benefiting nation  happy.  And their happiness is generally bought and paid for in some real and tangible way. 

Also, for what it's worth, this is something that China is arguably doing much better than the United States.  Instead of starting large endless wars... they're making long term deals and setting up big business in many smaller less powerful nations."
1601863914.0|worldnews|tcsac|"Just... no.  ""We"" (lockheed) will incorporate customization in the planes we sell TO THEM.  Israel had 0 role in ""developing the F35 platform"".   I mean, FFS, they weren't even part of the Joint Strike Fighter funding...

https://en.wikipedia.org/wiki/Joint_Strike_Fighter_program"
1601863912.0|worldnews|thisispoopoopeepee|naturalist fallacy. Why the hell are you on computer it's not natural? Why do you shower it's not natural? huurr huurrh urrrrrr
1601863901.0|worldnews|Toad0430|Lmao
1601863900.0|worldnews|Bealzebubbles|We had no community spread for three months which means we beat it. We didn't have three months of u diagnosed spread otherwise we would have been inundated with cases. The second wave was caused by a new infection coming through the border but we don't know exactly how. The first cases were linked to company that imports frozen food so that is a possible vector but unable to be confirmed.
1601863897.0|worldnews|PyrZern|So, how do they get rid of bodies ? Cremating !
1601863895.0|worldnews|snarkywombat|">and other tiny islands like Vietnam

Uh...me thinks you need to look at a map again"
1601863892.0|worldnews|sirblunts87|This is sad news and I know the news is addressing it as covid related but could it not be something to do with the perfumes? Someone in my family is extremely allergic to any smell of perfume and cannot be around it.  What is the Japanese media saying about his death same thing?
1601863885.0|worldnews|ShiftyDM|Payments were monthly. So each returned payment was $2,000.
1601863885.0|worldnews|day_oh|Kinda like the idea of a utopian society its more of an ideal that one has to strive for but as flawed  humans we could never become.
1601863876.0|worldnews|ChongoFuck|"Its fuckin childish entitlement.  ""GIMME DAT!"""
1601863866.0|worldnews|lamirg|"Could say the same for you.

Your family wouldnt exist if it wasnt for your brave meat eating ancestors."
1601863853.0|worldnews|Fight2RemainDead|Halloween was (still is I guess) my favorite holiday for some time just because I could hide behind a mask. I still enjoy halloween but this year they'll be no bonfire/large gathering.
1601863847.0|worldnews|BirthdayRobotZ|"Fuk this propaganda

AZ is the bully"
1601863846.0|worldnews|montypython112|I hate having more disposable income on average than anywhere else in the world! It sucks here, which is why nobody is trying to move here.
1601863841.0|worldnews|CreditUnionGuy1|😁 what if it’s not asleep but just living out what ever life cycle it has.
1601863836.0|worldnews|I_dont_like_sushi|"So you really believe the US will not explore the gold, minerals, jewels and everything else available in the amazon? Do you think they won't kill natives and take their lands? You really believe that? 

No government will save the amazon. Get out of your fantasy box"
1601863835.0|worldnews|randomguy506|That translate to no one doesnt care
1601863834.0|worldnews|ElderStatesPug|This is really wholesome.
1601863826.0|worldnews|MostSensualPrimate|"So you're anti-BLM because some of them are bad.  But you can't blame the cops because some of them are bad?

And that's alt-right Trumpet hypocrisy in a nutshell.  And yes, it's based in racism.  There's a reason you guys hate BLM for protsting racism, there's a reason you say white supremacy isn't a problem and that racists aren't a problem. 

From your post history it's clear you're a white supremacist.  The further you go the more certain it is."
1601863825.0|worldnews|f_ences|Yes and they're still making excuses to why he did name a guy they hate. They have a theory that he will nominate 8 out of the 11 members of the Supreme Court counting with his re-election. They wanted a right wing Supreme Court and thats not what they think they're getting so far.
1601863823.0|worldnews|jimthe1965|What a joke that would be!
1601863820.0|worldnews|Hippojaxx|They don’t use usd there they use krona and it ends up being like 12 dollars
1601863813.0|worldnews|Cynikal818|"Turkey is. Thwyre trying to make a PanTurk nation. If you think they're going to just take a little piece of Armenia and not the whole thing you really havent been paying attention

And if you think oil justifies murdering people, wow...idk what say to that


All I know is if this turns into a genocide again, we better do something"
1601863811.0|worldnews|Onebadhero|I normally go around Red Cloud Mine, it’s a bit further out but easier to get to.
1601863808.0|worldnews|leftyghost|Did rona put this out?
1601863807.0|worldnews|LLCodyJ12|"What an absolutely terrible thing to say.  

People like you who would willingly strip the rights away from people simply because of their age are detrimental to a functioning Democracy."
1601863802.0|worldnews|satanvacation|Acting like non-Americans on reddit don’t do that about America anyway lol
1601863797.0|worldnews|DatBingBong|"You obviously can, but you started this argument claiming that no one could lol. Pick an argument and stick with it, I can’t argue against you because your points are not even related lmao.

Are you arguing that your “educated guess” is just as valid as mine? Or are you arguing that no one can make an educated guess?

You’re contradicting yourself with each new argument you come up with in each comment.

AND, on top of that, I never said you couldn’t do the same thing. I don’t think you even know the point you’re trying to make."
1601863788.0|worldnews|SomeFatAssNinja|I get confused, astronomy is the cool one, astrology is the one for wackos, right?
1601863779.0|worldnews|Hi_Supercute|That’s like Hawaii rn!
1601863776.0|worldnews|ThePrem|Check your math...500,000 active cases in France and 7,700,000 worldwide based on YOUR source...6.5%
1601863771.0|worldnews|powderizedbookworm|"Barring some major technological innovation to sequester CO2 more efficiently than a tree does, and/or a large-scale reflective solution, I think we’ve already fucked ourselves on the environmental front.

Weirdly though, I think we’re closer to the universal harmony in a societal sense than it might look like. I can only really speak to the US, but I don’t think the Reactionaries would be this loud, this obnoxious, and this *unprincipled* without some conscious or subconscious sense that there is a real change afoot.

I also do witness more casual empathy than casual cruelty as time goes by, but I think the screaming reactionaries are easier to see."
1601863771.0|worldnews|TheMania|"Yes, we will never limit something where the fee for doing it is $0/t and it remains legal to do.

Those saying ""regulation is our answer"" are taking the Venezuela approach, and in that I include the US and Australia and others half assed about climate change. The irony of how much both countries will suffer is not lost on me."
1601863769.0|worldnews|CorrectProblem2|lmao
1601863766.0|worldnews|binzoma|SO hyped for sunday already. so hyped. that first haka/anthem is going to be amazing. I almost threw my laptop when ticketek was acting up when they went on sale
1601863751.0|worldnews|no-eye_contact|Jesus christ dont click that link. That gave me phone aids.
1601863747.0|worldnews|JDGumby|Welcome to the party, folks.
1601863741.0|worldnews|satanvacation|You’re going to be downvoted to hell for this factual statement. Non-Americans on reddit don’t miss a beat. I saw this one guy who’s post history was allllll about Trump and all this shit and I saw this one comment he posted where he says he’s not American, and never been to America.
1601863739.0|worldnews|xanaxandkabobs|Elon did this
1601863739.0|worldnews|rustproduct678|"I apologize to you. My comment was unwarranted and (so it seems) highly unfavorable. I was getting tired of seeing the same old back and forth hate. It's a highly divisive time - of which I am sure most think Trump is to blame. I blame narratives pushed by the media.. 

At the end of the day, my hope is we can all come together discuss our many vast differences that make us human give and take a little on the exchange and than leave a little bit more informed and educated. We can hopefully all stay classy and remain United in our efforts to improve life liberty and the pursuit of happiness."
1601863738.0|worldnews|CharityStreamTA|You really think that 12 year olds are men?
1601863738.0|worldnews|thisispoopoopeepee|"> As if animals needlessly suffering so that other animals can exist is okay

HAHAHAHA this guy.. Get a load of this guy.

Guess what if i was a deer i'd rather some bubba down me with his .300 win mag that have a[ F#%@ING BEAR EAT ME ALIVE](https://www.youtube.com/watch?v=JzwbOZKfrUQ)  <---- here's the organic way a deer dies. Right there 100% USDA choice organic. Yeah me i'd take the round out of nowhere.

Go take your pills."
1601863737.0|worldnews|montypython112|"He's saying fuck the Houthis, as it's clear they're not the benevolent victims of an airstrike, but a terror group capitalizing on a tragedy to garner support for their terror group. If the US accidentally bombed a schoolbus in ISIS territory ISIS would do the same. Would you then say, ""yeah, totally feel for ISIS, sure they burn people in cages and rape women, but that's the US's fault!""

You are literally falling for some of the most obvious and shitty propaganda in the world"
1601863737.0|worldnews|mg_ridgeview|I wonder if this is a bad omen.
1601863731.0|worldnews|leftyghost|As opposed to traditional games for British children, taking up the cross at 15, shouting Dues Vult, and marching to the Middle East to try and behead Muslims.
1601863723.0|worldnews|R3ddspider|I find you and your comment unpleasant, begone
1601863723.0|worldnews|Imperial007|Seeing the poor Italian hospitals getting overloaded on the evening news for a week was what sealed it. No New Zealand government, Labour-led or National-led, could have not taken action after that and expected to ever have a chance of getting back in at the election. New Zealanders had the expectation that it would be stopped, and so the government had to find a way to deliver on that.
1601863723.0|worldnews|thr0wawayacct0101|Bolsanaro is a man of principle . He can’t be bought.
1601863716.0|worldnews|Duff_Hoodigan|But do they *taste* fresh? That is the question.
1601863716.0|worldnews|EnemyAsmodeus|"Ironically, the Pope is the one who along with the US authorities helped destroy communism of USSR in 1980s.

But really Catholicism has nothing to do with socialism, aside from the fact that the new pope is from Latin America which has a lot of socialist ideas floating around."
1601863707.0|worldnews|Conspiring_Bitch|What a small minded perspective.
1601863706.0|worldnews|turdfergusonyea2|It would be nice if drive in theaters made a comeback!
1601863705.0|worldnews|coniferhead|Turns out it's blood
1601863688.0|worldnews|CharityStreamTA|I think you're chatting bullshit as you don't reply to people who prove you wrong.
1601863685.0|worldnews|PressureWelder|what? you probably think antifa is just a label too right? fuckin lunatic
1601863684.0|worldnews|retropieproblems|Modern man is cro magnon I’m pretty sure
1601863677.0|worldnews|Important-Ad6228|Can confirm, in Sydney: Mars very bright, even alongside a full moon
1601863673.0|worldnews|ang-p|"Compare 

https://e3.365dm.com/20/10/1600x900/skynews-floods-france-saint-martin-vesubie_5118006.jpg


with

https://www.google.co.uk/maps/@44.0749572,7.2486258,122a,35y,134.25h,69.43t/data=!3m1!1e3

Think that Elan petrol station has closed for the time being...."
1601863667.0|worldnews|R3ddspider|So stop paying attention to you? Actually that sounds nice, guys just ignore the incel
1601863666.0|worldnews|Aryel3789|You don't have a say in a territory that's not yours
1601863665.0|worldnews|ItsBigSoda|Let’s not pretend that the government wouldn’t abuse the living fuck out of it
1601863653.0|worldnews|bc4284|Yea at least they investigated and arrested ours just Get Paid vacations still. And an investigation never happens at all
1601863653.0|worldnews|kylanbac91|Because India is the biggest democracy country.
1601863652.0|worldnews|fueryerhealth|Does anyone have any idea how important the rainforest is? It seems like no one cares. This is so insane. We NEED the rainforest. Not just for selfish human reasons but so many amazing important animals live there as well.
1601863639.0|worldnews|childofsol|it's a socially acceptable fetish for death and murder
1601863634.0|worldnews|nicefacedjerk|I didn’t know Biden had $20 BILLION🤷🏼‍♂️.. All those afternoons playing the slots 🎰 really paid off.
1601863630.0|worldnews|sacre-noir|If you have even a decent pair of binoculars you can see one or two of Jupiter’s moons and Saturn’s golden color!
1601863628.0|worldnews|Armadylspark|"Little bit of column A, little bit of column B.

We can recognize that some controversy exists and that it is certainly not being received with the unanimity you're implying.

To your credit, it has proven more popular than I would have *expected*."
1601863623.0|worldnews|TheMania|"Avoid beef people.

1 beef patty/yr requires about as much land as 4 flights a year, if the flights were powered by solar panels.

Eating mammals is *incredibly* land intensive. Eat chicken, if you don't want to commit to doing more."
1601863616.0|worldnews|dthrowaway113|That’s the point
1601863612.0|worldnews|MasterKeef1992|I'm not saying I want it, I just don't agree with burning down forests. Call me crazy  I guess
1601863611.0|worldnews|Sir_Encerwal|"Tolkien was indeed a product of his time but he is nowhere *near* Lovecraft's level of bias in his works and in real life. Lovecraft basically feared *anyone* who wasn't protestant and white, which he did not make subtle.

"" Examined at headquarters after a trip of intense strain and weariness, the prisoners all proved to be men of a very low, mixed-blooded, and mentally aberrant type. Most were seamen, and a sprinkling of negroes and mulattoes, largely West Indians or Brava Portuguese from the Cape Verde Islands, gave a colouring of voodooism to the heterogeneous cult. But before many questions were asked, it became manifest that something far deeper and older than negro fetichism was involved. Degraded and ignorant as they were, the creatures held with surprising consistency to the central idea of their loathsome faith. ""- H.P. Lovecraft, The Call of Cthulhu"
1601863609.0|worldnews|Giers|"I'm pretty much on board with everything you said, I do take drunk driving far more seriously then most do, and I think if your willing to get behind the wheel drunk, and put everyone around you life at risk... Well that is fuzzy line for me. As soon as you pass that mark of "" I can do this stupid thing and hurt myself"" to "" I can do this stupid thing and kill multiple people"" Gah it start to get very black and white for me, and that's where I start not caring so much about him dying.

THAT said, this all could have been solved peacefully if he could have just locked his house up, called the RCMP and gotten a decent response time. Rural RCMP coverage is pathetic and I think that is the biggest issue facing the sparsely  populated prairie provinces.

An yes working on trains is a bit like being held over the edge of the volcano, for some reason people just do not hold back opinions around them."
1601863609.0|worldnews|KingDanNZ|Sent from your iPhone
1601863608.0|worldnews|allison_gross|"That's why you read from multiple scientific sources

The Guardian doesn't understand this issue.  Scientists do.  So I listen to scientists.  Not known-transphobic-tabloid The Guardian."
1601863607.0|worldnews|R3ddspider|Get back into the cave or the pit, your choice
1601863600.0|worldnews|dvdbrownr|We're going to have to live with it. A vaccine will help but it is here to stay...
1601863599.0|worldnews|RubberKeyboard|Most things are more important than ideology. Ideology matters to the little people. Realpolitik is how the world runs.
