1601865035.0|AskReddit|nothingbeatagoodshit|Sashimi.
1601865035.0|AskReddit|princessberry1222|Cool! What do they eat?
1601865035.0|AskReddit|honeybear13612|There was a point in time where I didn’t want to get married because I thought marriage was just filled with yelling and arguing. Ever since a young age I’ve never really seen my future being married. I’m still young and my views have changed a bit but as of now I don’t want anyone
1601865035.0|AskReddit|payperplain|"Little bit of red sauce for dipping, something a bit sweet but not overly so. If you're in a hurry you can put it on the bread under the cheese, but it can get a bit messy if you over do it.   


If you're REALLY in a hurry you can throw some meat and veggies on it and have a little meal to go all in one slice that you can eat with one hand."
1601865034.0|AskReddit|kittythiccc|For some reason I always start on the bottom right
1601865034.0|AskReddit|bigbuzz55|Why can’t we just be from another city
1601865033.0|AskReddit|DukeBeekeepersKid|Not buying condoms.
1601865033.0|AskReddit|agathor222|"this makes me realise i have had very few happy moments in my life .... acquiring certain items or what not is meaningless... ive never had a healthy relationship... i always fuck everything up... 

i like saying when my niece told me she loved me, but that leads down a dark path...

i dont do much. and im lonely. and depressed.

nothing goes right. nothing changes.

i wish it were over."
1601865033.0|AskReddit|sauce_on_sneakers|Having your favorite meal.
1601865031.0|AskReddit|TheSorryConservative|Why?
1601865031.0|AskReddit|NeroZeroXYZ|Either Roblox or Minecraft to be honest.
1601865031.0|AskReddit|chocotacogato|True I guess. Idk if this is a bad idea but I always get the blended olive oil. Like the kind where it’s not exclusively from one location
1601865030.0|AskReddit|Lilisss|Here to reply :)
1601865030.0|AskReddit|Lampy5|I love that one. It’s so mannerly yet cutting
1601865030.0|AskReddit|Awesomesause1988|An Eskimo who obsessed with the Kurds
1601865028.0|AskReddit|nocturnal077|Don't drink soda huh?
1601865028.0|AskReddit|HanssomeDavid|By being plain better than him.
1601865027.0|AskReddit|PurpleGuy-1987|FEAR ME!
1601865026.0|AskReddit|KobeMamba824GOAT|You have a point but just recently Basketball was ranked the 3rd most popular sport it is loved especially in China where over 800 million Chinese watched the 2018/2019 NBA season programming on TV. The only western artist I say is known worldwide is Michael Jackson
1601865026.0|AskReddit|PapaTwoToes|I've dipped my fries into sundaes at McDonald's before, so.....
1601865026.0|AskReddit|riotclit|Why are you talking about politics 🤦‍♀️
1601865025.0|AskReddit|Boiler2001|Unless you are applying for a job in politics, anything political would be a disqualifier.  Normal employers don't want activists in the workplace.  It interferes with work/profits.
1601865025.0|AskReddit|bloodshed113094|So, the username isn't just for show. You are genuinely sour.
1601865025.0|AskReddit|ima-rage-quit|I love listening to real narrators and sometimes the fake but good quality, mainly when I’m doing something like homework or yard work.
1601865025.0|AskReddit|bugenhagen15|Slave Leia obv
1601865024.0|AskReddit|TheSorryConservative|Me too.
1601865024.0|AskReddit|bsd8andahalf_1|they came back for the fish.
1601865023.0|AskReddit|Patsx5sb|Yes. They actually suspended him from school the day of a game because he forgot the brand new rule and wore the doo rag anyway.
1601865023.0|AskReddit|kookiie_pickles|Yum
1601865023.0|AskReddit|Hyperf0cused|Being dragged out of a tiny bathroom by paramedics adter I fell and fractured my ankle and chipped a bone in my knee.
1601865023.0|AskReddit|poopwithjelly|Oh fuckin no. I knew a farmer that lost fingers in a thresher and taped his god damn hand to the knob. That moment of panic they both must have felt is not something I envy.
1601865023.0|AskReddit|is_not_availiable|Suicide prevention
1601865022.0|AskReddit|Echospite|">I gotta say it’s a little strange to me that people in this thread keep bringing up the fact that being married means you are now obligated to help your partner when they’re sick or you’re now obligated to work on your problems instead of leaving. You weren’t willing to do those things already? Okay 🤔 

That jumped out at me too. Yikes.

NGL though if I got sick and had a partner, I'd probably be more afraid they'd leave if we weren't married. Which probably wouldn't say anything good about the relationship."
1601865022.0|AskReddit|jukeboxheroine|Get a therapist, even if you don’t think you need one. Eat well, even if it means more effort. Try to exercise and get sunlight every day possible.
1601865021.0|AskReddit|imgprojts|"Ok so this shit again.... Pisses me off.... Simple... Droplet of water ~20 microns.... Virus molecule<<1micron. I should say ""any questions"" but  ok... 1 drop could carry millions of viruses. And it can evaporate into a smaller droplet or it can get bigger or completely go to molecules of h2O. So assuming the water goes away, does the coronavirus stay in the air? Or somehow magically it gains Uber mass and drops like a stone.lol. no it stays in the air and lands on another droplet as soon as you breathe it in."
1601865020.0|AskReddit|minertyler100|Too many.
1601865020.0|AskReddit|starkravingsober|🥇
1601865020.0|AskReddit|albundy72|I’ll dig up my cats grave and hide it there- if they have the horrible personality to dig up the grave, they’ll have to go searching through all the dirt while their mental health fades away.
1601865019.0|AskReddit|SoyOrbison87|Apple cucumber bacon cubes
1601865019.0|AskReddit|lost_access|Your wife's parents encourage you to have sex with their daughter and get angry if you don't.
1601865019.0|AskReddit|supagirl277|I’m gonna straighten it and push it into my carpet so it lays flat in the cushion layer or on the subfloor
1601865019.0|AskReddit|daggerxdarling|Every fucking time. Or it's $3000 and doesn't actually do what they say it will/can only do it in extremely specific cases.
1601865018.0|AskReddit|Ferret1_4|To be honest I kind of like channels like memenade
1601865017.0|AskReddit|SundayMorningTrisha|"Oversized wallet chains made out of tow chains.  Nothing said ""I'm awesome"" more than walking around titled to one side.  Possibly why I have some problems with that leg nowadays."
1601865016.0|AskReddit|PurpleGuy-1987|"with pleasure old sport! 

do you prefer with a knife or bare handed!?"
1601865016.0|AskReddit|LiLMosey_10|Australia. People actually think we get bitten by snakes everyday and fuckin crocodiles walk on the side of the road.
1601865016.0|AskReddit|solojones1138|Easy, I go back in time and don't go to grad school. Too much money man...
1601865015.0|AskReddit|Mister_Way|"If you are sure they will not, then do not. 

Don't judge people too hastily, though."
1601865014.0|AskReddit|TheSorryConservative|I'm good
1601865013.0|AskReddit|mistakenidenty-|That im a fat loser
1601865013.0|AskReddit|Mycrost|Hi neighbor!
1601865013.0|AskReddit|420Findom|Oop💀 did I
1601865013.0|AskReddit|bigbuzz55|Why was it your fault?
1601865013.0|AskReddit|The_SetoKaiba|Amazing? Do you know why?
1601865013.0|AskReddit|MarvinTheMartian77|My heart goes out to Willy wonka 😔
1601865013.0|AskReddit|TrueEgon|Buy me a house and give a bit to the people I care about.
1601865013.0|AskReddit|fartful-dodger|In the Hat of the Night
1601865012.0|AskReddit|monkeyss715|He’s working in the next cubicle
1601865012.0|AskReddit|arwilson521|I never watch them because I usually see the posts first hand on reddit. But something about the text to speech voice really pisses me off
1601865012.0|AskReddit|boredNquarantine2020|"I was the home wrecker once and I don’t know why I did it. I’ve always hated cheaters and when I found out he was married I was absolutely furious and disgusted with him. At that point we didn’t even do anything, he just flirted with me at work (we worked together at a restaurant) we didn’t have each phone numbers or anything. Well I would talk to him or even look at him for a while and then some how and for some reason over time he got me to laugh at his jokes and we became friendly again and well one thing lead to another. It was awful of me and when I look back at it I can’t believe I did something like that. I don’t have a reason why I did it, just know that it won’t ever happen again. 
But basically I lost respect for myself and all my friends. They didn’t know this man at all but they were disgusted with my actions. I can’t change the past but I can make sure it doesn’t happen again. 
The wife knows, me and her talked for like 2 months everyday and it’s a thing he does all the time. she hates me obviously but I guess she doesn’t hate me as much anymore cause we’re cool. She’s still with him and he’s still out there cheating, I don’t work with him anymore."
1601865011.0|AskReddit|cursed_window_man|So I'm not the only one
1601865011.0|AskReddit|countontay|Thanks sumo😂
1601865010.0|AskReddit|kittythiccc|Well it’s not healthy but ay you do you ig
1601865010.0|AskReddit|nothingbeatagoodshit|Something else. No doubt for attention.
1601865010.0|AskReddit|epic_0600717|You frogot to add arson
1601865009.0|AskReddit|beendoingit7|If I've obtained knowledge that I'm fighting Jon Jones and study him for years on years while training, I still would not have a shot at winning lol neither would about 99.99999999% of the population.
1601865009.0|AskReddit|rawsugar87|Dr. J. Mortimer Granville invented the vibrator in the 1880s because doctors were getting to tired of literally rubbing women to get them to reach orgasm.
1601865009.0|AskReddit|minertyler100|Plumber saves a princess.
1601865008.0|AskReddit|AutoModerator|"**PLEASE READ THIS MESSAGE IN ITS ENTIRETY BEFORE TAKING ACTION.**

Hi there! Your question has been removed as it looks like you're asking a question that violates r/AskReddit's [Rule 3](http://www.reddit.com/r/AskReddit/wiki/index#wiki_-rule_3-) 

DAE (""Does Anybody Else"") questions and questions that can be answered with ""yes"" or ""no"" are not allowed in r/AskReddit. Try rephrasing your question to be more open ended, or submitting to one of the following subreddits:

- /r/polls
- /r/DoesAnybodyElse
- /r/DAE
- /r/WhatIsThisThing


Otherwise if these don't fit your needs, check out the [multireddits in our sidebar](http://www.reddit.com/r/AskReddit/about/sidebar) which cover almost every topic imaginable, thanks!

If you feel this was removed in error, please [contact the mods](<http://www.reddit.com/message/compose?to=%2Fr%2FAskReddit&subject=Help+Related+Post+Review+Request&message=My+post+was+removed+for+being+help+related,+please+review%3a%0d%0a%0d%0ahttp%3A%2F%2Fwww.reddit.com/r/AskReddit/comments/j5bjze/does_anybody_know_when_the_world_is_gonna_go_back/>). 

*I am a bot, and this action was performed automatically. Please [contact the moderators of this subreddit](/message/compose/?to=/r/AskReddit) if you have any questions or concerns.*"
1601865007.0|AskReddit|SaigoBattosai|Grilled Cheese
1601865007.0|AskReddit|Emilylenore|Dope
1601865006.0|AskReddit|Random_redditor3626|This question is posted here almost every single night
1601865006.0|AskReddit|THE-ONION-RING-KING|Bottom left corner and work my way counter clock wise
1601865006.0|AskReddit|NotAnNSASpySatellite|Companies no longer value people, we’re all replaceable. Don’t be loyal to a company that isn’t doing their best for their staff. It’s nice to give 2 weeks, but unless you contract says you have too, sometimes it’s nice to burn a bridge and just walk out.
1601865005.0|AskReddit|princessberry1222|What? I'm googling this
1601865005.0|AskReddit|dudedaderp|Maybe because I’m 14...
1601865005.0|AskReddit|TheSorryConservative|ok
1601865005.0|AskReddit|TwilitSky|"All Zelda games.

Chrono Trigger.

Secret of Mana.

Ultima Online.

The Ultima series."
1601865004.0|AskReddit|0100100012635|The 'Rona Twenties
1601865003.0|AskReddit|The_Tyrannos|I just played as IQ in R6S, later suckers
1601865002.0|AskReddit|Abraham_Yoder|If you're familiar with the Police Academy movies, I've randomly had the song from the Blue Oyster Bar stuck in my head all week. It's been years since I've watched any of those movies.
1601865002.0|AskReddit|MilitantPacifist13|So family members can eat the rest.
1601865002.0|AskReddit|abeast0333|Exactly like you could get arrested for witchcraft or wizardry. And unless you could demonstrate what nail polish is, you'll die lmao.
1601865002.0|AskReddit|Script256|"Why would anyone care? If people watch them it's because they prefer that format, its not like there is something stopping them from coming here.

And if anyone here feels robbed because they showed his comment on a video grow the fuck up. What bothers you? YouTube users not being able to give you useless points? You feel like its ""your content""? That makes no sense"
1601865002.0|AskReddit|rayrayrayray|Shaving razor blades. Cereal is crazy expensive, my brother and I used to eat that shit a lot
1601865001.0|AskReddit|cryptic_slays|His dick? Idk never been in a relationship...
1601865001.0|AskReddit|bigmeme-furdude|I guess some crackheads like the crystal ice
1601865001.0|AskReddit|awggswau|Just kids trying to act smart on the internet. I've made mistakes as well.
1601865000.0|AskReddit|turducken19|Lame and uninteresting.
1601865000.0|AskReddit|mitharas|">  but it really isn't the same site anymore  
  
Stuff changes over time, more news at 12."
1601864999.0|AskReddit|420Findom|Grounded 🤝
1601864998.0|AskReddit|KookooMoose|Because someone who actually isn’t promask would be downvoted to hell for answering the question honestly. This is Reddit
1601864997.0|AskReddit|Meatwad5|That’s ok, a man can dream.
1601864997.0|AskReddit|irdbri|Taco seasoning
1601864997.0|AskReddit|tits-question-mark|Would you rather have a drawer full?
1601864997.0|AskReddit|doodlepants7|Yes. And I absolutely love them.
1601864995.0|AskReddit|milkduds249|early 2000s jeans under skirts/dresses trend #burn it
1601864995.0|AskReddit|AutoModerator|"**PLEASE READ THIS MESSAGE IN ITS ENTIRETY BEFORE TAKING ACTION.**

Your post has been removed as it violated [Rule 2](http://www.reddit.com/r/AskReddit/wiki/index#wiki_-rule_2-). Please check that your post doesn't contain the following issues:

* **Your post cannot have first person pronouns (I, me, my, etc)**

* **Your post can't be specific to your situation or involve a story. Please make sure to depersonalize your question (such as removing personal pronouns) and remove any unnecessary context before posting it again.**

**Please use one of these subreddits:**

* Need advice? /r/advice or /r/self or /r/relationship_advice

 * Can't remember something? /r/TipOfMyTongue 

 * Looking for a particular subreddit? /r/findareddit.
Please note - once posted, the titles cannot be edited. If your title breaks the rules, please feel free to [make a new post](/r/askreddit/submit?selftext=true) that fits within the rules.


*I am a bot, and this action was performed automatically. Please [contact the moderators of this subreddit](/message/compose/?to=/r/AskReddit) if you have any questions or concerns.*"
1601864994.0|AskReddit|AutoModerator|"**PLEASE READ THIS MESSAGE IN ITS ENTIRETY BEFORE TAKING ACTION.**

Hi there! Your question has been removed as it looks like you're asking a question that violates r/AskReddit's [Rule 3](http://www.reddit.com/r/AskReddit/wiki/index#wiki_-rule_3-) 

DAE (""Does Anybody Else"") questions and questions that can be answered with ""yes"" or ""no"" are not allowed in r/AskReddit. Try rephrasing your question to be more open ended, or submitting to one of the following subreddits:

- /r/polls
- /r/DoesAnybodyElse
- /r/DAE
- /r/WhatIsThisThing


Otherwise if these don't fit your needs, check out the [multireddits in our sidebar](http://www.reddit.com/r/AskReddit/about/sidebar) which cover almost every topic imaginable, thanks!

If you feel this was removed in error, please [contact the mods](<http://www.reddit.com/message/compose?to=%2Fr%2FAskReddit&subject=Help+Related+Post+Review+Request&message=My+post+was+removed+for+being+help+related,+please+review%3a%0d%0a%0d%0ahttp%3A%2F%2Fwww.reddit.com/r/AskReddit/comments/j5bjvc/does_anybody_know_when_the_world_is_gonna_go_back/>). 

*I am a bot, and this action was performed automatically. Please [contact the moderators of this subreddit](/message/compose/?to=/r/AskReddit) if you have any questions or concerns.*"
1601864993.0|AskReddit|LopensLeftArm|Find a way to allow them to separate peaceably into smaller, more ideologically homogeneous nations. I think it's inevitable anyway, the only question will be whether it's going to come with armed conflict or not.
1601864993.0|AskReddit|The-Unknown-sees-you|Brains
1601864993.0|AskReddit|RandoBoomer|"One guy just started ripping into ALL his former employers, bosses, coworkers, you name it.   
 Worse, he was getting clearly agitated.  Some of these issues went back over 5 years, and he's turning red-faced in front of me.

I don't ask trick questions.  I'm not trying to trap anyone.  If you say you had a problem with a coworker, I'll believe you.  It happens all the time.  But if you're just this side of an aneurism over every perceived and actual slight, well let's just say they're always hiring at the Post Office."
1601864992.0|AskReddit|money_back_guarantee|Trump and COVID
1601864992.0|AskReddit|XiaoWuLee|I wasn’t the biggest fan before, but now I love lamb shoulder chops once in a while.
1601864992.0|AskReddit|NySportzguy|Bang as many girls as you can. Don't be afraid nobody will remember a damn thing in 10 years.
1601864992.0|AskReddit|Random_posts_22|What was with the fluoride? Is it some 'murican thing that you only see in the bible belt?
1601864991.0|AskReddit|3-Clin3_2a|You must have been thinking about Trump getting the plague.
1601864991.0|AskReddit|cursed_window_man|"
Have you tried it?"
1601864990.0|AskReddit|Hydrohoes| A build up energy BUZZ then Split perception of conscience reality that is very real from the complexity/intensity of the journey to the core. Confidence it's as if I left family for war screams even as I motion to darkness from the presence of the source
1601864990.0|AskReddit|Nuftacular|That farmer was probably thinking: Some sleep will do me good
1601864989.0|AskReddit|introvertedArtsy|Down the toilet
1601864988.0|AskReddit|Spicy-Samich|2021 will start
1601864988.0|AskReddit|KangarooSouth|I don’t really care tbh. Some of those people got me into some of my most favourite subreddits, so if anything, I should be thanking them
1601864988.0|AskReddit|Snedker23|"People tend to hold their bodies in incredibly high regard. This stands even after they’re dead.  A lot can likely be pointed towards religion and any sort of after life. But others could simply be because they haven’t thought of donating after death, or just haven’t had a good discussion about the benefits of it.

Personally I want as much of me to go to people in need as possible. I don’t have any reason for keeping it."
1601864988.0|AskReddit|CG_anon|A girl I briefly saw yelled at me for both holding doors open for her, and not holding doors open for her. It didn’t last long. She also yelled at me for eating two chips out of a bag of chips she was eating lol
1601864988.0|AskReddit|CookinFrenchToast4ya|Ever see the movie Repeaters?
1601864987.0|AskReddit|RetardosaurusRex_|And then comes the question what do you do when you cant find yourself.
1601864987.0|AskReddit|bloodshed113094|Same! We're Brush buddies!
1601864986.0|AskReddit|colt4524|This is what I dont get about that explanation... for a human to live/survive, all parts have to be functioning properly (lungs, heart, brain, eyes etc...) So how could it have been a gradual change of each of those things over time if they have to all function at once. It seems to me that it had to start that way...
1601864986.0|AskReddit|Jeff_9000|How to play what?
1601864986.0|AskReddit|coxmandem|Thats illegal
1601864985.0|AskReddit|question-Asker323|Yep. Even the best people have their own personal issues that can get seriously outta hand.
1601864984.0|AskReddit|Kevat|Through your wallet?
1601864984.0|AskReddit|DirtySouthCityBoi|You're legally recognized as a couple.
1601864984.0|AskReddit|AMinecraftNinja5|In my paperclip box
1601864983.0|AskReddit|420Findom|this sounds like a horror movie whyy
1601864983.0|AskReddit|Boomerang503|Depends on what I'm in the mood for.  Chicken egg foo young, sweet and sour chicken, or steamed chicken with vegetables.
1601864983.0|AskReddit|TunnelRatVermin|On the 16th, it will be level squished to 50. Max level in Shadowlands will be 60.
1601864982.0|AskReddit|hernondo|Straighten it out, and hide it on top of one of the wires in the furnace filter.
1601864982.0|AskReddit|ukcanguy|"It is a really debatable question with no real correct answer.  

Some will think it's great to have children because they want their current country to grow and prosper with future generations. Seeing with what we have achieved in the past century regarding technology and cross culture relationships I agree in a way.

Others think it's not a good idea since as you said, climate change and the direction earth is heading is not looking too promising which I agree with also. 

It's a double edged answer."
1601864982.0|AskReddit|TheSorryConservative|Your an happy? Why must you mix Spanish and English together?
1601864982.0|AskReddit|NutButter1205|"Cough 

America

Cough"
1601864981.0|AskReddit|Former_Rock5428|It's not a bad answer as long as they follow part 2 and tell me why.
1601864981.0|AskReddit|attackedmoose|Gun sword and time travel.
1601864980.0|AskReddit|NeroZeroXYZ|I’m okay, just tired is all.
1601864980.0|AskReddit|cjsdsp|All 4 of your great grandmothers are still alive?
1601864980.0|AskReddit|reflect-the-sun|Outside Earth's atmosphere (they died in space)
1601864980.0|AskReddit|ArcNight00|There's so much irony in this post
1601864979.0|AskReddit|ItAllDepends99|It is absolutely true.
1601864979.0|AskReddit|Guns4224|Invisibility.
1601864978.0|AskReddit|AutoModerator|"**PLEASE READ THIS MESSAGE IN ITS ENTIRETY BEFORE TAKING ACTION.**

Your post has been removed as it violated [Rule 2](http://www.reddit.com/r/AskReddit/wiki/index#wiki_-rule_2-). Please check that your post doesn't contain the following issues:

* **Your post cannot have first person pronouns (I, me, my, etc)**

* **Your post can't be specific to your situation or involve a story. Please make sure to depersonalize your question (such as removing personal pronouns) and remove any unnecessary context before posting it again.**

**Please use one of these subreddits:**

* Need advice? /r/advice or /r/self or /r/relationship_advice

 * Can't remember something? /r/TipOfMyTongue 

 * Looking for a particular subreddit? /r/findareddit.
Please note - once posted, the titles cannot be edited. If your title breaks the rules, please feel free to [make a new post](/r/askreddit/submit?selftext=true) that fits within the rules.


*I am a bot, and this action was performed automatically. Please [contact the moderators of this subreddit](/message/compose/?to=/r/AskReddit) if you have any questions or concerns.*"
1601864977.0|AskReddit|Glittering-Inside|Yeah he has the rona. Might wanna stay away.
1601864977.0|AskReddit|TO_4567|Scrumptious
1601864977.0|AskReddit|picklesupreme|Lime juice
1601864977.0|AskReddit|lilipads4113|Grapes, I always thought the price shown was for the whole bag, until I realized it was per pound as an adult
1601864977.0|AskReddit|SilverThyme2045|Huh... Not nintendo...
1601864976.0|AskReddit|kittythiccc|That would suck lol
1601864976.0|AskReddit|W1LL_E|I prefer my dick to be in a museum than for a medical student to cut in half.
1601864975.0|AskReddit|ArborghastGod|The 20s
1601864975.0|AskReddit|Ninotchk|Few people are at their best in an ER.
1601864975.0|AskReddit|Jeff_9000|Why is that?
1601864974.0|AskReddit|mincraft-meme-lover|Up my ass
1601864974.0|AskReddit|princessberry1222|Is that....you?
1601864973.0|AskReddit|Bamce|"they answered that question

>In the USA healthcare is a business ..."
1601864972.0|AskReddit|grimweed11|His name was Robert Paulson
1601864972.0|AskReddit|AutoModerator|"**PLEASE READ THIS MESSAGE IN ITS ENTIRETY BEFORE TAKING ACTION.**

Hi there! Your question has been removed as it looks like you're asking a question that violates r/AskReddit's [Rule 3](http://www.reddit.com/r/AskReddit/wiki/index#wiki_-rule_3-) 

DAE (""Does Anybody Else"") questions and questions that can be answered with ""yes"" or ""no"" are not allowed in r/AskReddit. Try rephrasing your question to be more open ended, or submitting to one of the following subreddits:

- /r/polls
- /r/DoesAnybodyElse
- /r/DAE
- /r/WhatIsThisThing


Otherwise if these don't fit your needs, check out the [multireddits in our sidebar](http://www.reddit.com/r/AskReddit/about/sidebar) which cover almost every topic imaginable, thanks!

If you feel this was removed in error, please [contact the mods](<http://www.reddit.com/message/compose?to=%2Fr%2FAskReddit&subject=Help+Related+Post+Review+Request&message=My+post+was+removed+for+being+help+related,+please+review%3a%0d%0a%0d%0ahttp%3A%2F%2Fwww.reddit.com/r/AskReddit/comments/j5bjol/does_anybody_know_when_the_world_is_gonna_go_back/>). 

*I am a bot, and this action was performed automatically. Please [contact the moderators of this subreddit](/message/compose/?to=/r/AskReddit) if you have any questions or concerns.*"
1601864971.0|AskReddit|DynastyPotRoast|Retire and flip my middle finger to the world.
1601864971.0|AskReddit|cryptic_slays|That's not a small reason bud...
1601864971.0|AskReddit|jewel976|If it’s a “specific” paperclip, I hide it in a box of other paperclips
