1601863145.0|worldnews|yogobot|"http://i.imgur.com/tNJD6oY.gifv

This is a kind reminder that in French we say ""omelette *au* fromage"" and not ""omelette _du_ fromage"".

[Sorry Dexter](https://www.youtube.com/watch?v=8nW3-9gdjYA)

[Steve Martin](https://youtu.be/DOJDNChwgBw?t=2m49s) doesn't appear to be the most accurate French professor.

---

^(The movie from the gif is ""OSS 117: le Cairo, Nest of Spies""  https://www.imdb.com/title/tt0464913/ )"
1601863142.0|worldnews|squished_raccoon|Not controlled at all, broadly or narrowly.  The president is on a covid spreadicade as we speak.
1601863130.0|worldnews|gnocchicotti|Omelette du fromage to you too
1601863128.0|worldnews|psyche77|">When you hear “the stars mandate an age of peace and harmony beginning in a couple months,” how do you respond. Do you want an Age of Aquarius to begin around December 21? What actions would you have to take? What attitudes would you have to cultivate?

Scientists generally agree we are living in the most critical time in human history, because humans have developed vast inequality and the capacity to destroy the planet through nuclear war and setting up unstoppable catastrophic climate change (see California).

We have a ways to go to get to the peace and harmony stage, and may not make it.  The so-called Aquarian Age symbolizes the possibility of a change, or mutation, in human consciousness, but the only pathway is through the dissolution (Aquarius) and destruction of obsolete structures, in society, religion/mythology and individual awareness.

We should note that we are leaving the Age of Pisces, which symbolizes male perfection (Jesus and all our gods and prophets) and moving into the age of perfected femininty (Mary Magdalene and #MeToo) and all the reckonings against male authority and domination.

We must learn to take care of our planet and co-species.  This is a feminine job though the guys could help a lot.  There's a lot at stake."
1601863125.0|worldnews|AutoModerator|"Your submission has been automatically removed pending manual approval because your account does not meet the minimum karma or account age requirements of /r/worldnews for submitting from an uncommon domain. 

If you are new to reddit, we suggest you read

* [reddit 101](http://www.reddit.com/r/help/comments/2bx3cj/reddit_101/)

* [How reddit works](http://www.redditblog.com/2014/07/how-reddit-works.html)

* [The rules of /r/worldnews](http://www.reddit.com/r/worldnews/wiki/rules)

You may also want to review the [Reddit guidelines regarding spam](http://www.reddit.com/help/faq#Whatconstitutesspam) and the [wiki on self-promotion on reddit](http://www.reddit.com/wiki/selfpromotion). 

*I am a bot, and this action was performed automatically. Please [contact the moderators of this subreddit](/message/compose/?to=/r/worldnews) if you have any questions or concerns.*"
1601863124.0|worldnews|Dmoney86|Everyday French with Pierre Es Cargot
1601863121.0|worldnews|Raisoshi|"Self destruct implies there will be consequences. More than half the population supports him, that's why he's the president, and most likely there won't be much consequence to his actions if at all.

He's our own tropical Trump, and his voters are very much alike Trump's in their mindsets with all that gun, mysoginistic and racist bullshit."
1601863112.0|worldnews|MorelsandRamps|Yeah there are a lot of issues with the hardest right traditionalist Catholics these days. I’m not sure if we’re in schism territory yet - if anything they’d leave and join already existing schismatic groups like SSPX. But you’re right in pointing out the tension exists and the antagonism is largely coming from the right.
1601863101.0|worldnews|ninjaninjaninja22|What an arsehole
1601863101.0|worldnews|Mahoney2|"Idk, man. I’m kind of losing interest in this conversation, but I guess I’ll point out one thing - your examples are terrible. Amazon absolutely dominates its market, treats its employees like shit, and is literally being investigated by the FTC in an anti-trust probe.

You bring up entertainment, which is something that people constantly look for new forms of and Ford, which got bailed out by the government to compete with foreign markets because it failed. Terrible examples. 

Companies don’t control sectors of the economy BECAUSE the government stops mergers like the AT&T-T Mobile one and monopolies. That’s the whole freaking point..."
1601863100.0|worldnews|Gallijl3|"Can you please post a study where they've reached the conclusion that children do not spread the virus? I have never seen anything that's come to that conclusion.  I'm not doubting you, I would just legitimately like to see this.

EDIT:  If you click a few links to get to an actual study that is being cited, you get statements like this:

""The evidence-base on the likelihood of adults infecting children is limited, but between them, the highest-quality studies suggest that adults may be approximately half as likely to transmit infection to children in the same household, as they are to transmit infection to adults in the same household. There is also weak evidence that children are less likely than adults to transmit infection to others.""

Taken from Royal Societys DELVE initiative
https://rs-delve.github.io/reports/2020/07/24/balancing-the-risk-of-pupils-returning-to-schools.html

That doesn't inspire confidence..."
1601863092.0|worldnews|hoxxxxx|[your comment reminded me of this](https://www.youtube.com/watch?v=HL2QP2tt9ZA)
1601863085.0|worldnews|Armadylspark|"America is far to the right of Europe. Naturally that will also be reflected in its churches.

I think this confusion stems in part from the fact that for the average member, whether in America, Europe or elsewhere church affiliation is more a question of identity rather than any particular faith or reasoned argument. So you have all these individual but unspoken heterodoxies springing up from a deep-seated difference in cultural values.

Of course, nominally the pope is supposed to speak for the whole church, but he's not doctrinally infallible at all times and many Americans are already so entrenched in their individual views that ""Not my pope"" becomes a tantalizing alternative."
1601863084.0|worldnews|RedderBarron|Actually given the recent chain of arab nations offering to recognise israel and the palestinian reactions to it, i'd say many arab states are getting mighty sick of the palestinians shit
1601863078.0|worldnews|webby_mc_webberson|"and elminationzees

I watched LOTR yesterday with my son for his first time so I'm all up on the hobbit lingo"
1601863077.0|worldnews|rocknroll2013|TCOB Paris'
1601863077.0|worldnews|Webo_|No one is denying colonial rule caused massive issues for India, but blaming any and every problem modern India has on colonialism is illogical and part of the problem. Colonialism didn't cause the current attitudes towards women, and refusing to acknowledge and take responsibility for the problem is part of the problem.
1601863072.0|worldnews|bodyonus1|"Good for her!!! The internet has really been good for enabling the cowardly to become bold. I hope she continues, someone else's opinion of you, does not have to become your reality. A wise Asian woman once told me,"" some people are like dogshit on the sidewalk, you should try to go around rather than step in it."" These days there is a lot of dog shit...."
1601863069.0|worldnews|adriennemonster|I noticed it right next to the full moon a few nights ago, didn’t know about all this crazy conjunction stuff, but when I realized it was Mars, I had a really uneasy feeling.
1601863067.0|worldnews|ThisIsFlight|">This is exactly what happens to men when they say a woman behaved poorly. Women get away with whatever they want because everyone assumes that when a man is the victim of something he must have done something to be wronged in the first place.

I had forgotten the ""not"" in there. Also, sick excuse. Its a wonder how anyone has ever been burned by someone else has immediately taken up a disdain for whatever flavor of category their aggressor belongs to.

Its almost as if they can recognize that humans can be shit, but not all them are and that they shouldn't base an entire outlook on the various groups of them based on the few experiences theyve had with individuals.

>Except I'm not an incel and I don't hate women.

Incels and their mysogyny rarely ever come from hate. Its used spawned from mismanaged and/or incorrectly or unprocessed pain and fear."
1601863058.0|worldnews|Artorias_Abyss|Man I remember back in 2016 when reddit fucking hated the TPP, even hillary clinton did a 180 on it. Now I can't tell if it was astroturfed to hell or people actually had such strong opinions against the TPP.
1601863054.0|worldnews|rubiks_cube040|Vietnam is neither tiny nor an island...
1601863051.0|worldnews|seKer82|The only way Brazil stops destroying the rain forrest is if its no longer profitable or by force.
1601863051.0|worldnews|GlassMom|"You're too poor to afford a lawyer, too?

All that lying, manipulating and cheating is how the US works.  If you're not paying scrupulous attention, you're snoozing and losing. People get paid handsomely to do this for businesses. This is where we are with that. We write our laws and methods of enforcement by voting, schmoozing, and yes, with money.

 If you don't want to be like that (I don't), you have to research and read like a hungry hawk, and we *have* to watch each others' backs.  This is why divisive leadership is bad.  It keeps us from getting to know each other for who we really are."
1601863048.0|worldnews|Lord_Blakeney|This was my understanding as well. My belief was the the overall reduction of active conflicts and drone campaigns was the one good thing of trumps presidency
1601863032.0|worldnews|neon_pentagram|"I'm not a voter for him and I don't like Bolsonaro, but there's something about his decision that is actually right: international interest on amazon rainforest is old. USA interest is even more. Its not because of climate change or deforestation, it was always because of: 1. Good position for military bases; 2. Unprecedent economic exploration.

In Brazil, there's a long term discussion about international help being used as a precedent to crush it's sovereignty. And it's not a conspiracy theory. There are plenty of speeches coming from American, French and British leaders saying that amazon rainforest should be an international territory. I believe that's a necessary context to understand what happened.  

Bolsonaro is still a moron? Yes

He doesn't know how to handle internacional politics? Double yes 

But implying that throwing money over Brazil because we HAVE to solve a problem that is not an ""amazon rainforest problem"", but a ""global biomas"" problem, is, to be honest, quite disrespectful. It suggests that the whole responsability for solving climate change problem is on Brazil's shoulders. 

And, well, it's not. 

Also, it's not nice when you blame a country of being unable to handle its own forest protection - and being a threat to the world -, but you speak from a country that made its entire history and economic development on fucking up mother nature."
1601863028.0|worldnews|Ricky_RZ|Slowly, yes
1601863023.0|worldnews|hoxxxxx|i want a giant red ball in the night sky goddamnit
1601863013.0|worldnews|Hidden_Incum|"Indeed. Right now both Armenia and Azerbaijan would be the equivalent of city states, and with no way to force a civ to stop attacking a city state ally several civs have potential casus belli to declare protectorate wars against each other if any of them involve themselves overtly and directly in the conflict. 

Though Russia and Turkey have similar tech levels, Turkey's allies might not be willing to declare war on Russia which has a much higher military score and a large stock of nuclear weapons."
1601863010.0|worldnews|ModernDemocles|"Music existed before the Beatles. It will continue to develop.

Most countries have their own rich musical history.

Once again, America is not all bad. It does have some deep seated issues that need to be fixed. Failure to acknowledge that will mean you cannot fix it.

Music inherently borrows from what comes before. If you don't know that you are a shit artist. It's rare you will find something 100% unique."
1601863009.0|worldnews|darez00|Noticed two nights ago over here in Mexico, I wasn't sure if it was Mars or Venus
1601863000.0|worldnews|webby_mc_webberson|imagine going to all that trouble just to lose a game of rugby
1601862999.0|worldnews|JamalFromStaples|It 100% is :)
1601862995.0|worldnews|bombayblue|"Ok so it’s a court not recognized by international law and with no ability to carry out its own decisions?

Why is this on Reddit? Literally anyone can sign the same decree from their own kitchen if they want the same authority."
1601862993.0|worldnews|Kracker5000|"I don't agree with your nihilistic ""well nothing *actually* means anything but you still choose to give a fuck"". That's not what I was getting at, I'm not a nihilist and my original comment wasn't nihilistic either. I just know that throwing dice, the alignment of the planets, and the shape/ color of my last shit are of all equal capability in predicting future events, and are also all of equal importance. That's why I don't care or choose to look into it."
1601862987.0|worldnews|Johnnadawearsglasses|"> Overall, the picture is so varied that a link between schools and coronavirus transmission cannot be proved, the report suggested. Other factors, including the country's health system capacity and economic openness and the robustness of its testing and tracing system, must be considered. 

>The analysis backs up what scientists increasingly believe - that children, initially thought to be major potential spreaders of coronavirus infection, do not appear to be playing that role. However, at the same time, there is a growing body of work showing the detrimental effects of keeping kids out of school across the globe.   

This summarizes the report and is broadly consistent with the scientific consensus I have seen. The issue in the US is that covid is not broadly well controlled and hence the concern about schools."
1601862986.0|worldnews|EvidenceBase2000|Test it in India, Brazil or Wisconsin. You’ll know soon enough.
1601862979.0|worldnews|JamalFromStaples|Go to MT Pinos it’s better. And it’s only two hours away, compared to Joshua tree which is three. (Depending what part of LA you’re in of course)
1601862979.0|worldnews|CompetitiveProject4|"Yup, we may still hike but we won't be able to really enjoy the view. 

And the multimillion work done to clear the landscape to see Rainier in UW's fountain is kinda pointless for the next month. Eh, we were probably going to stay in and get trashed anyways"
1601862969.0|worldnews|marsrover001|Neat
1601862961.0|worldnews|DanialE|RIP chinese people having to sit in the shithole that xijinping will leave them in
1601862959.0|worldnews|ac34842|Is that bad?
1601862958.0|worldnews|Jay_Bonk|"Lol you're so dumb, literally in your link, in history it says invented in Bogotá Colombia.

And it's irrelevant, cunts can be inventive. The Soviets had a ton of nobel prize winners...didn't make them less cunts
You're from a cunt country, full of cunts like yourself. Cheers."
1601862953.0|worldnews|pianoloverkid123456|Yea of course
1601862940.0|worldnews|MacAttacknChz|">women are unaccountable.

WOOOOWWWWW"
1601862940.0|worldnews|macaeryk|"When they ask who said it, I’ll say, 

“Retodd did.”"
1601862937.0|worldnews|killingitatlockdown|So we should remove him from power or his people should, why do people who are most effected by these idiotic rulers keep letting them run the planet into the ground. Fucking there's only one of him, only one Chinese pooh bear mother fucker and only one trump. Why must people suffer so those in power can live comfortably, fuck this shit
1601862935.0|worldnews|jarfil|No kink shaming.
1601862935.0|worldnews|yamchan10|You’re already in hell, look at the comments you keep getting burnt.. but whatever ur prob just some angry sand Gypsy
1601862934.0|worldnews|webby_mc_webberson|"> other than QR codes at businesses 

America: ""i don't want no dang gubmint trackin me!!!"""
1601862931.0|worldnews|guebja|The Daily Mirror isn't a far-right tabloid. It's a center-left tabloid.
1601862927.0|worldnews|G_o_o_d_n_a_s_t_y|The board has stock options, too. You should Google about the myriad cases where shareholders have sued the board for *not* maximizing short-term profits. Starting in the mid-80s with the first big wave of leveraged buy-outs, maximal shareholder value became gospel for Wall St bc of Harvard Business School professors preaching that a company investing its profits in the company was inherently much less efficient than disgorging those profits to its shareholders as quickly as possible. The idea behind this was that any good company can just cheaply borrow money to make internal investments and as such holding cash reserves or investing it in human resources from sources of profit was a misuse of that profit that devalued each dollar. Why invest $1 of profits in HR today when all it will get you is $0.05 in profit by the end of the year (even though it may profit $10 in 2 years) when you could just get a cheap loan and hire management consultants to insulate yourself from accountability for internal investments being mismanaged. Once that doctrine became gospel and globalization could hit formerly Communist markets, we started seeing many huge companies become gradually hollowed out, from Dell to GM. [If you want to learn more here, skim this.](https://corpgov.law.harvard.edu/2017/08/08/how-shareholder-value-is-killing-innovation/)
1601862922.0|worldnews|MelloDawg|The last paragraph is the real salient point here; a strike isn’t going to move the needle enough for anyone to seek continuity.
1601862916.0|worldnews|Vickrin|Wouldn't it just be easier to teach astronauts to drill?
1601862915.0|worldnews|Nikiforova|"I think that ""man vs man"" or ""man vs nature"" are pointlessly reductionary ways to look at a critique of a complex socioeconomic system, ultimately. It's a critique of capitalism, and that's the way it should be understood."
1601862909.0|worldnews|PHATsakk43|In this case, it’s not. It’s literally an FDA approved process regarding a specific chlorine treatment for poultry during processing. It’s not a “catch all” but a specific thing done for a specific reason.
1601862904.0|worldnews|Moe__Ron|And since it's 2020, Mars will suddenly explode for no fucking reason.
1601862898.0|worldnews|SoonerSoonerSooner|What does the size have to do with it? 25% is a small percentage whether is be an ant hill or the Pacific Ocean. Also, not sure what you're getting at with the population, Brazil ranks 81st in population density.
1601862897.0|worldnews|crabmuncher|If I were a penguin this would be NSFW
1601862894.0|worldnews|BeCurry|Yes.
1601862888.0|worldnews|plipyplop|The little switch near the door.
1601862888.0|worldnews|LocusofZen|"Which God, exactly? The one that's cool with sacrificing children as burnt offerings on mountaintops or the one that's down with fucking 11 year olds? 

It's a trick question. Don't strain yourself."
1601862887.0|worldnews|RedderBarron|And also every structure has been turned into a bomb shelter. That helps.
1601862886.0|worldnews|daemonelectricity|Then fuck off.
1601862883.0|worldnews|LyonKing-|"I think your numbers are WAY skewed, but I'm just assumming that. 

I think he's got a 90% of coming out totally fine, and having it help his campaign. 

""See!? If I a 74 year old man can beat it, what are the rest of you worried about?"""
1601862883.0|worldnews|76767676767676766766|I can already see it first thing in the evening, it’s red and is where to moon rises. Then this morning I could still see it at dawn even when every other star had gone.
1601862876.0|worldnews|radar661|How fast is this guy tearing down the rainforest?
1601862870.0|worldnews|Sir_Bumcheeks|BoJo wasn't in power during Brexit, it was David Cameron, and Cameron's cabinet was always anti-Brexit, he 100% did not expect the referendum to pass. I just remember every news/journalist show (like Andrew Marr) just ragging on how Brexit was a bad idea.
1601862869.0|worldnews|patoankan|Butte County, right between the North fire complex and the Zogg fire.
1601862863.0|worldnews|GullibleIdiots|Mars is bright tonight.....
1601862859.0|worldnews|PressureWelder|much like all cinemas, how are they still able to keep the lights on? thats a lot of square footage to heat with no customers lol.
1601862859.0|worldnews|xMichaelLetsGo|Communism doesn’t have a state
1601862858.0|worldnews|lufalo|Use this 20 bilion to rainflorest california or other state. Very stupid .
1601862856.0|worldnews|NoleSean|So can cars! Don’t ever go on the road again.
1601862845.0|worldnews|QB145MMA|“Good god Jim I’m a teacher not a doctor!”.  Just posting what the article says, interesting read.
1601862839.0|worldnews|xMichaelLetsGo|Capitalist
1601862835.0|worldnews|GameofCHAT|Love and patience wins every time!!
1601862829.0|worldnews|Windairio|Lmao the racism on this thread is through the roof.
1601862827.0|worldnews|pictorsstudio|"The demand for masks caused the companies to make them.  

What I describe in the second paragraph is not only the products but the things that people do with the products, like gaming.  Gaming stores were closed so people couldn't meet their friends and do the thing they enjoy. 

"" Basically you were so addicted to products you weren't prepared for any real problems, that's sickening. ""

He says posting from his iphone which he wouldn't have without capitalism."
1601862824.0|worldnews|Zarzavatbebrat|"Well if your ""different views"" are that it's okay to be a scumbag then that indeed makes you a scumbag. I don't know you, but ""different views"" isn't an excuse to act like a dickwad no matter who you are."
1601862813.0|worldnews|FoxPowers|"problem is, no one can point a finger at the magic bullet that worked for NZ.  Everything theyve done exists in another country whos not come close.

best guess, luck that it never really snowballed, and that its a relatively small population to keep track of.

If someone has a magic bullet, do share."
1601862812.0|worldnews|dwpea66|"No, a different lady.   
  
You can register stars under your own name, right? Well this one lady correctly figured that the Sun is a star too, so she got it registered with no problem.   
  
And at one point, she planned to tax people for the good of Spain."
1601862804.0|worldnews|obviously_discarded|"I read this as "".. Women alleging gang rape can use 'explosive' corporate documents"".

I thought they were allowed rape you with exploding paper."
1601862803.0|worldnews|ModernDemocles|">We have faaaarrr better food, entertainment, better parks and wildlife, we revolutionized technology over and over and over again, we dominate popular culture.

Food? I don't think so.

Entertainment, I'll accept that.

Parks? Really?

Wildlife? Also, really?

Not saying you haven't revolutionised technology. As I said America isn't all bad, however, there are still some very concerning indications about how you are regressing in some key areas.

Americans like to say they are number one, however, in most key metrics they aren't even close.

>(Let’s not forget that the American political revolution was globally monumental, and you can thank us for your ability to vote and have a voice, too)

Democracy goes back to antiquity. The American revolution was significant, for sure.

>I get that shitting on Americans is your hobby, but I have better things to do than to be a smug cunt on the internet.

Not really, if an American accepts that their country has its good and bad, I am ok with them. I just don't accept anyone viewing their country through a myopic lens.

I don't have a problem with Americans. I have a problem with American exceptionalism."
1601862798.0|worldnews|grumd|I agree with what you wrote, but what would be the incentive to create new companies and ideas it you aren't going to get more out of it rather than working at an already successful company?
1601862793.0|worldnews|solzhen|Orcas are going to appreciate the extra protein.
1601862791.0|worldnews|empty_coffeepot|Yeah, it's not like Turkey is a NATO member or something.
1601862789.0|worldnews|AutoModerator|"Your submission has been automatically removed pending manual approval because your account does not meet the minimum karma or account age requirements of /r/worldnews for submitting from an uncommon domain. 

If you are new to reddit, we suggest you read

* [reddit 101](http://www.reddit.com/r/help/comments/2bx3cj/reddit_101/)

* [How reddit works](http://www.redditblog.com/2014/07/how-reddit-works.html)

* [The rules of /r/worldnews](http://www.reddit.com/r/worldnews/wiki/rules)

You may also want to review the [Reddit guidelines regarding spam](http://www.reddit.com/help/faq#Whatconstitutesspam) and the [wiki on self-promotion on reddit](http://www.reddit.com/wiki/selfpromotion). 

*I am a bot, and this action was performed automatically. Please [contact the moderators of this subreddit](/message/compose/?to=/r/worldnews) if you have any questions or concerns.*"
