1601864913.0|AskReddit|artsy897|Terrible!
1601864913.0|AskReddit|kittythiccc|I’m good how are you
1601864913.0|AskReddit|mukn4on|That’s the only answer I understood.
1601864913.0|AskReddit|Bamce|"> In the USA healthcare is a business ...

Soooo yeah, healthcare may be a business, and I hate it.

But if I could make a phonecall and not have to expose myself to a potentially dangerous or at the very lease mentally unstable person on the regular? Your dam right I would try to avoid said person for my own well being."
1601864911.0|AskReddit|StMaartenforme|Have taken multiple MMPI tests & drug tests for nuclear power plant jobs.  Never failed any.  Yes for nuke jobs they are reasonable & should be required.
1601864911.0|AskReddit|Azmedon|Yep was going to say this.
1601864911.0|AskReddit|ArborghastGod|Yeah, but it’s impossible to know it.
1601864910.0|AskReddit|_newaccount_whodis|The Mindy Project
1601864910.0|AskReddit|TheAbsoluteLastWord|Butch Vig.
1601864909.0|AskReddit|JobImportant1395|Ya
1601864909.0|AskReddit|JRSmithsHenny|huh?
1601864908.0|AskReddit|Buttareviailconto|In a bucket of thousands of other identical paperclip
1601864907.0|AskReddit|feor1300|Wouldn't that mean one in each hand? lol
1601864907.0|AskReddit|weedful_things|Many, if not most, of those chronically homeless have really bad mental health issues.
1601864907.0|AskReddit|GuitarOwl864|Reminds me of the chubbyemu video about the farmer who tried to cut out his skin cancer with a pocket knife
1601864906.0|AskReddit|awesomeDdogs|Do you have any stories
1601864905.0|AskReddit|xiaomaomiii|"oh my gosh that sounds horrible :(( im so proud of you for staying strong though! i cant even imagine what that must be like because ive never been in your position, but i can tell its really tough. i do hope you can overcome this rough time in your life soon.

also i know what you mean by thinking your worst moments were in your past haha. life just keeps seeming to go downhill sometimes and it may seem like theres no way out. but we'll all make it in the end"
1601864905.0|AskReddit|420Findom|congratulations this is beyond what I was expecting. It’s so beautiful 😭😭😭😭😭😍😂😂 BUT FUCK THAT X
1601864905.0|AskReddit|xtrachromo_man|Because it fucks with my asthma
1601864905.0|AskReddit|milkduds249|get your driver's permit as soon as possible
1601864905.0|AskReddit|justheretojerkit2020|Fucking waste. That's prob why we got these teens and younger CHILDREN coming in droves -_-
1601864905.0|AskReddit|LiLMosey_10|"Fun fact.

 Flamingos are actually white. They are only pink because of their diet."
1601864904.0|AskReddit|Stairway756|Did that plan work out for you? Or did it backfire?
1601864904.0|AskReddit|Kwa_m4|Grab a gun and check it out
1601864903.0|AskReddit|Bosenraum|Jaw
1601864903.0|AskReddit|93911939|Continue using reddit
1601864903.0|AskReddit|ImProbablyHammered|"Is ""big sky rock daddy"" better?"
1601864902.0|AskReddit|shhhhh69|Is that enough money to buy a hooker with tits made out of cocaine?
1601864902.0|AskReddit|drdoom52|"Mixed.

On the one hand, websites like Reddit and 4chan do represent the public and citing them for information regarding journalism is becoming more common.

On the other hand, they're letting redditors do the hard work of producing the content, then just picking the already voted cream of the crop and repackaging it with minimal effort.

Overall, fairly negative. But then again, there are youtube channels which consist of ""pretty girl, doing regular things and videoing it while occasionally talking about interesting things"" or ""gamer guy plays horror game and has massive overreactions to everything he sees"" which proceed to gets thousands of views daily. So really are we more ticked off at the youtubers, or the people who upvote them?"
1601864902.0|AskReddit|PurpleGuy-1987|I'm already in a springlock suit so may as well go as a robot.
1601864902.0|AskReddit|Passing4human|"Steven Wright. ""I recently installed a sunroof in my apartment. The upstairs neighbors hate it.""

""For Christmas I got a humidifier and a dehumidifier. I locked them up in a room together and let them fight it out."""
1601864902.0|AskReddit|Tricky4279|Not my thing, but you do you.
1601864901.0|AskReddit|Down_To_My_Last_Fuck|"Might be a relief.

the biggest bitch with getting old is wondering how long you've got.  First it's your parents and the older folks in the family. then it's people you went to school with. at some point close friends start fading, this one or that one is losing his mind and his wife is trying to deal. 

Every step is one step closer to the great unknown. When you start to envy those folks who have fooled themselves into believing that something better waits on the other side."
1601864901.0|AskReddit|chasing-daylight|Climate change took centuries to accelerate and will take centuries to stiffle...it does not matter who is elected, YOU wont see a change in the climate especially when countries like China, India, Russia dont give a shit....the weather moves west to east as does the pollution.
1601864900.0|AskReddit|MarvinTheMartian77|Rottweiler chased me and my best friend and her little sister but she got away by a bike, and according to her, the dog was like a nanometer away from nipping me my back
1601864900.0|AskReddit|TunnelRatVermin|Dr strange, the flash and Saber
1601864900.0|AskReddit|vegeta8300|Yup, there are many comments that don't seem to understand that. It seems you are arguing with most of them, lol. I got your back, for what its worth. :)
1601864900.0|AskReddit|BOI2812|Wow that's actually a really interesting exercise to explain how blindness is experienced, it totally is what I refer to in my OP, also I'm sorry about your situation
1601864900.0|AskReddit|queen-of-the-butt|My ass
1601864899.0|AskReddit|BigBubbaJim|Larache is my favorite city in Morocco, and althoigh I feel like it has become more popular in recent years I think Morocco is an amazing tourism destination
1601864899.0|AskReddit|__domi|r/GuessThatSpot
1601864898.0|AskReddit|Lusterkx2|I hate those robotic text speech channels. This channel is relatively new. Seems like the channel is starting off and it seems like a great narration compare to those robotic text to speech.  I can actually understand the tone and stories. [https://www.youtube.com/channel/UC7A1UBgBC5MtvzpfmJMnv7g](https://www.youtube.com/channel/UC7A1UBgBC5MtvzpfmJMnv7g)
1601864898.0|AskReddit|TheSorryConservative|Just curious.
1601864897.0|AskReddit|jedidopedawg|Khan academy on astronomy. Explaining the sizes and lengths of our earth to the solar system to the galaxy and to the universe.
1601864896.0|AskReddit|DAY-B|Have you tried nofap?
1601864896.0|AskReddit|ReallyKirk|Bottom center
1601864896.0|AskReddit|majibbsultra7|Tri tip or even baby back pork ribs
1601864895.0|AskReddit|Slippyrabbitt|I have crippling depression
1601864895.0|AskReddit|Jeff_9000|Sounds fun!
1601864895.0|AskReddit|mspfhoqw|"Imagine this: Team starts at their own 20. 1st down no gain. 2nd down no gain. 3rd down, 30-yd pass attempt, incomplete, but: PASS INTERFERENCE, DEFENSE, BALL PLACED AT SPOT OF THE FOUL. So now the team has the ball at the 50 from gaining absolutely no yards at all, just because the penalty ""placed the ball at the spot of the foul"".

Then from the 50: 1st down no gain, 2nd down no gain, 2rd down another 30-yd pass attempt, incomplete, but oh no PASS INTERFERENCE PLACE BALL AT SPOT OF FOUL. So now they have the ball at the 20-yd line from doing nothing at all, just riding 60 yards JUST from the penalties.

Now they have the ball at the 20. 1st down no gain 2nd down no gain 3rd down they attempt the endzone but OH NO PASS INTERFERENCE BALL PLACED AT ONE YARD LINE AUTOMATIC FIRST DOWN. So now they have the ball at the 1, from doing absolutely nothing at all, they just rode penalties to get there. Then they take 3 downs to punch in 1 yard and get a touchdown. From gaining a total of one yard and riding penalties to get literally all the rest of the yards.

How fucking STUPID is that? Fucking broken sport if this can happen."
1601864895.0|AskReddit|solojones1138|Yeah I am from the US so I read BBC for news..it's already less biased but with US news they also don't have a dog in the fight.
1601864894.0|AskReddit|Random_posts_22|One of those leaders had a Jesus fetish. Ironically, they probably also condemned homosexuality and telling teenage boys to masturbate to Jesus isn't helping.
1601864894.0|AskReddit|Zackiechan666|Everyone is just gonna say the area they live in.
1601864894.0|AskReddit|NothingHereAfterAll|Heck yeah!
1601864894.0|AskReddit|minertyler100|I like to eat a tiny bit of whatever stuff we have to throw out.
1601864893.0|AskReddit|Mansardonfire|I can honestly say I've never liked Trump or understood why others did. Even as a kid when he had cameos in movies or started pushing his branding with the board game and such...he's always seemed like such a totally tacky ass.
1601864893.0|AskReddit|the_paperclip|sure megatron grabbed the gun but prime woud've shot the fucker if megatron didnt have hot rod held in his arms
1601864892.0|AskReddit|SpaceDave83|I used to watch Sábado Gigante without knowing any Spanish.  It was still pretty funny.
1601864892.0|AskReddit|irsquareamads|I had a similar incident, but with my sister.   We were latch key kids (this was 1982) and I was around 12.  We were playing backyard football with our friends and I had the ball.  One of the other guys tackled me from behind and caused me to fumble.  As I was pushing off the ground to recover the ball, another friend jumped on it and my arm at the same time.  I heard the pop of my bone and felt the pain.  My sister, of course, insisted I was faking it and made me sit at the kitchen table until my parents got home from work, which was about 3 hours.  So my dad comes home and sees my arm about twice it's normal size and takes me to the hospital.  It was indeed broken and I got a free souvenir cast!  The fun part - the hospital was LITERALLY across the street from my house, you could see it out through the kitchen window.  Gotta love family.
1601864892.0|AskReddit|IndominusWretch|Tell them to fuck off.
1601864892.0|AskReddit|alexantoine12|in my pants
1601864891.0|AskReddit|Monty_pyton|My favorite dnd character has this name
1601864891.0|AskReddit|pls-yes|Oof
1601864890.0|AskReddit|reditty321|Wait so your saying that you want a stack of steak when you kill the cow right?
1601864890.0|AskReddit|Mentalfloss1|“Back to the old grind.”
1601864889.0|AskReddit|SumoSamurottorSSPBCC|Wow. You just have to be pain in my ass just because you can. You clearly understood my point so just stop. I don't feel like listening to this bs.
1601864889.0|AskReddit|bigmeme-furdude|Not a hotel worker but I think you’ll like this story. When I left home for 2 months I had to stay in a hotel in Denver over night due to stormy weather. At around 2am I arrived in my hotel room exhausted. When I collapsed on the bed I felt something rubbery under the sheets. Pulling back the sheets revealed a blowup sex doll. Thankfully it was either clean or it wasn’t used so I just tossed it in the trash can.
1601864889.0|AskReddit|sipping_fire|Walk in to someone
1601864889.0|AskReddit|captain_cudgulus|Health care, food, water, housing, various birth control methods including abortions, probably education, basically, things you need to be a functional member of society capable of becoming happy even if you aren't right now.
1601864889.0|AskReddit|AutoModerator|"**PLEASE READ THIS MESSAGE IN ITS ENTIRETY BEFORE TAKING ACTION.**

Hi there, your post has been removed for one of the following reasons: 

* [Rule 3:](https://www.reddit.com/r/AskReddit/wiki/index#wiki_-rule_3-) You must phrase the question to require more of an explanation than just ""yes"" or ""no"".  You may want to try to post your question in /r/polls.

* [Rule 3:](https://www.reddit.com/r/AskReddit/wiki/index#wiki_-rule_3-) Questions with a single correct answer, that can be researched elsewhere are not allowed on AskReddit.

* [Rule 1:](http://www.reddit.com/r/AskReddit/wiki/index#wiki_-rule_1-) You must post a clear and direct question in the title.  *The question must be a full sentence*.  Try including question phrases like ""What is..."", ""What are..."".


*I am a bot, and this action was performed automatically. Please [contact the moderators of this subreddit](/message/compose/?to=/r/AskReddit) if you have any questions or concerns.*"
1601864888.0|AskReddit|AutoModerator|"This submission has been automatically removed because it has 3 words or less. Please write your question in a proper full sentence, thank you.

*I am a bot, and this action was performed automatically. Please [contact the moderators of this subreddit](/message/compose/?to=/r/AskReddit) if you have any questions or concerns.*"
1601864888.0|AskReddit|79Binder|I hear that the guy selling them got a huge bank account.
1601864888.0|AskReddit|NySportzguy|Aggressive move
1601864888.0|AskReddit|the_nutter_butter|Optimus prime. “Get out of the way Hot Rod!”
1601864887.0|AskReddit|hegemonicht|This fella taught me a thing. So there's this creepy life-saving thing that arteries do. If a patient is bleeding out and gets hypotensive, the smooth muscle in the wall of the artery can spasm down and stop the bleeding temporarily. And the radial artery, spasmed down, looked goddamned exactly like a flexor tendon, to the entire surgical team. So they left him with me.
1601864887.0|AskReddit|TheNewMrBeast|PewDiePie (kinda obvious tbf), GioFilms, and Dark Dom are some of my favorites
1601864886.0|AskReddit|kevinrobb|Health Insurance! I used to pay about $1000 a month for a family plan THROUGH my employer!
1601864885.0|AskReddit|IPokePeople|Appreciated!
1601864885.0|AskReddit|queen-of-the-butt|'The losers'
1601864884.0|AskReddit|Jeff_9000|Luckyyyyy
1601864884.0|AskReddit|mitharas|The internet is all about reusing and modifying content. So... why not?
1601864883.0|AskReddit|cryptic_slays|I'm planning on confessing that I'm asexual but I don't know... It's really scary for me... Especially cuz my parents want me to continue the blood line...
1601864882.0|AskReddit|FromTejas-WithLove|The Great Digg Migration is what brought me here (different account).
1601864882.0|AskReddit|p0ultrygeist1|My cousin had 8 dudes take a paternity test, none of them were the father.
1601864882.0|AskReddit|dankumz|Yups and nopes
1601864881.0|AskReddit|therealmeatpie|Id buy $999,999
1601864881.0|AskReddit|derrick_zoolander23|De turtles an the masks an straws
1601864881.0|AskReddit|shabnomnom|VR
1601864881.0|AskReddit|PurpleGuy-1987|jokes on you my heart got ripped out of me!
1601864880.0|AskReddit|grey-clouds|"NAD but I had a patient come into ED with a bandaged arm after a fall at the nursing home, says he's nearly 100. The junior doctor and I start to take down his dressing, thinking maybe a bad skin tear...

The top of the wound is covered in a blood clot the size of my hand, and we legit couldn't tell if there was an open fracture under it or not, it was so swollen. The doc just pops the dressing back on and goes ""Uhhhh I'm gonna go call my consultant to come take a look at this"" and legs it. Patient was completely chill the entire time, and told me it was the first 'big' injury of his life at nearly a century old."
1601864880.0|AskReddit|The_Tyrannos|*doot*
1601864879.0|AskReddit|QAnonKing|That covid is so dangerous that we have to destroy the whole country by shutting it down in order to save it. In reality this circus logic is just an excuse to destroy the economy in order to make Trump look bad
1601864878.0|AskReddit|-whatthehelliswater-|Too many things are ruined by people trying to take credit for them.
1601864878.0|AskReddit|imnotsteven7|That sounds nasty. Never seen it.
1601864876.0|AskReddit|SampleText0822|I mean if they make jokes by themselves and actually put effort into it I don't see a problem with people getting millions of views.
1601864873.0|AskReddit|Phydoux|Going commandos
1601864872.0|AskReddit|JobImportant1395|I mean paying for porn is as weird as watching 2 strangers fuck so I wouldn’t say it’s weird because I watch porn myself. Do what you want dude and spend your money how you want. I’m not here to try and convince adults with the money they earned to not spend it how they want. If you wanna pay for onlyfans, Snapchat, porn, prostitutes, jack off to your imagination it really doesn’t hurt me. So you gotta choose what you wanna do and I doubt any of my opinions would change the mind of someone already doing what they want. If I could change someone’s mind that easy I would definitely try to change something else about them then where they spend their money.
1601864872.0|AskReddit|WhiteBird6944|strength +10 intelligence -100 looks -25
1601864872.0|AskReddit|t-r-o-w-a-y|Pretty women that give me attention. Even if they're toxic and it's clear it's not a match. I get this attachment that cripples me for months. I don't know what the root of it is but I suppose it's loneliness among other things.
1601864872.0|AskReddit|omnilynx|It doesn’t affect me at all.
1601864871.0|AskReddit|Probonoh|That's my logic. If I can't think about anything but the pain, it's a 10. If I can be distracted from the pain, 8 or 9.
1601864871.0|AskReddit|SeeCowashit|"Intelligence +100
Strategy +60
Class -50
Physical ability 0
Dick size -100"
1601864870.0|AskReddit|mishmash234|"In this vein, locksmiths

You need to get in? Give me money."
1601864870.0|AskReddit|healmeier|Wake up
1601864870.0|AskReddit|somecrazydude13|Eat it, shit it out, flush it down the toilet, gone forever
1601864869.0|AskReddit|MarmaladeCat1|"Fruit of the sea?   Bottom- feeding vermin of the sea seems more accurate. 

Still,  tasty."
1601864869.0|AskReddit|DjK7644|Alive to respond
1601864869.0|AskReddit|rumster|"Personal story...

I had to have a surgical kneecap realignment (also called tibial tubercle osteotomy and elevation).  The surgery went great and I was home within 3 days.   About 48 hours of being home I got thirsty and needed to go to the fridge.   The issue though is I'm the 2nd floor and the fridge is on the first.  But whatever,  I had crutches and I started making my way down the flight of stairs.   I made it about 4 steps down, when all of a sudden my cat flew right by my crutches and startled me.  I fell face forward down 24 steps and during the fall my legs bend completely back.  I heard this awful zipper noise from the leg which I come to find out was the staples (80 of them) ripping out of my surgical wound.   I completely black out on the bottom of the stairs and come to with my cat looking at me.   I have these immobilizers on my leg so I just compress the leg tighter and get up.   Again, thinking I didn't really screw my leg up.   I end up getting my drink and go back upstairs.   Not knowing how much damage I have done I lay down and take a nap.   About 2 hours after my mom wakes me up screaming and I look down and my stabilizer and bed completely red.  They call and ambulance who took me to the hospital and when I saw my Artho he said something I never heard another doctor say.  Are you a FUCKING IDIOT!  YOU ALMOST DIED TODAY!

Result - I ended up breaking 3 different areas including knee cap in half.  The zipper noise was actually all the stitches came out.   I also started getting and infection and almost like 2 pints of blood due to one of screws going into a vein or something.

Lesson learned?  Nothin, I was thirsty."
1601864869.0|AskReddit|flightlessbirdies|"""It's lucky you're pretty."" 

I have a friend who said this to me semi regularly"
1601864869.0|AskReddit|MilitantPacifist13|A kalimba
1601864869.0|AskReddit|fbodieslive|Property taxes are bullshit. I buy a home and have to pay the gov every year just for owning it. Bullshit
1601864869.0|AskReddit|mobius_stripper420|99.86% survivability rate. You're overreacting
1601864868.0|AskReddit|vrmvroom|always have someone you trust to talk to
1601864868.0|AskReddit|telegrafony|"Once during a medical checkup, the medic was looking for my veins and saw that it was just popping out. He said ""nice""."
1601864867.0|AskReddit|Trey-2008|Fake jake
1601864867.0|AskReddit|MrRobertSox|Call a 24 hour pharmacy, and ask them.  Or call poison control.
1601864867.0|AskReddit|zebediah49|[The classic fuse sizing guide](https://external-preview.redd.it/hMyKCqho5V2kdvWONIltMBwbE4nh7Y5zUFfZs5FhSjk.jpg?width=910&auto=webp&s=5ffc6d6895824f8a8299ff54473d132624cbb9c2).
1601864867.0|AskReddit|DAY-B|Lol what in the actual finuck?
1601864866.0|AskReddit|FaceTheLightToday|Studies! I spent 8 years of my life in university... God knows how much I spent.
1601864866.0|AskReddit|LunarTear47|I'm pretty sure you can find something on YouTube about this
1601864866.0|AskReddit|billybobjimmyjoe|Deepthroat tonsil action.
1601864865.0|AskReddit|ThirtyAughtSixx|enjoy it while it lasts
1601864864.0|AskReddit|bugz1452|When DNA replicates part of it is broken off. An enzyme  replaces it but only part of it. Think of it like breaking off 3 pieces but only replacing 2. This is a large part in why we age and eventually die. Also in cancer this enzyme can be overactive and add to dna when it's not needed creating cancer that never dies
1601864864.0|AskReddit|ilovespaceack|"want to stay vague to avoid too much bias, but it's a cult that is teaching relatives of mine (who i know to be very kind people normally) to think violent and fearful thoughts about minorities. Even about me as a queer person. 

I want to demonstrate empathy and humanity to them, while also not enabling hurtful behavior, or tolerating hurt towards myself."
1601864864.0|AskReddit|Bubba656|Make sure to add darkfluff
1601864863.0|AskReddit|Nintendork7950|I mean yeah it’s a bit lazy but if they’re properly citing their sources and list who made the posts then it’s honestly a decent way for people that don’t use Reddit to find good Reddit posts
1601864863.0|AskReddit|Rockin1O1|I mean I might wear a mask if there was corona around, but there’s not, so I’m not gunna wear one anytime soon
1601864862.0|AskReddit|Jeff_9000|Well, just so you know, reddit is here for you :D
1601864862.0|AskReddit|ThatsCashMoney|In classic? Still 60.
1601864862.0|AskReddit|974651874|"you can die from a sinus infection? huh

i had a really bad one but they never told me i couldve died lol"
1601864862.0|AskReddit|whitewolf369|Yess
1601864861.0|AskReddit|Fawkingretar|Wilbur Soot does, the other guys don't really have specific channels really.
1601864861.0|AskReddit|wirelineop|I don't know if it was underrated at the time, but October Sky is a really good movie. I've never heard anyone else talk about that movie except my family.
1601864860.0|AskReddit|CallHimIshmael|We're not talking about indecent exposure. Again the point is the government mandating a very specific garment to be worn essentially in order to go outside and live life and fining people for not doing so. I am not opposed to wearing them but people should have the choice. I'm very concerned with how welcoming people are of being told what to do and wear in this circumstance and welcoming it with force.
1601864859.0|AskReddit|RequiemFear|Cashews and pistachios especially. God damn they're expensive, but it's worth it.
1601864858.0|AskReddit|minertyler100|Literally just any compilation makers. Meme compilation, Minecraft compilation, among us compilation, twitch compilation, etc.
1601864857.0|AskReddit|nicko141|Which part of Australia may i ask i would ve in rural nt
1601864854.0|AskReddit|drunky_crowette|If I gave a single fuck about YouTube video views I'd probably still be upset at something else
1601864854.0|AskReddit|ididntaskyoukaren|What’s a pirate’s favorite restaurant?
1601864853.0|AskReddit|dracarys00|I like them, I can listen while I drive instead of trying to sit down and read them lol
1601864853.0|AskReddit|Tree-Frog51|Walter.
1601864852.0|AskReddit|CookinFrenchToast4ya|Try calligraphy
1601864851.0|AskReddit|NotMyNameActually|Ikea. They're cheap and they look fine.
1601864851.0|AskReddit|goodatbeingnotded|Some people can't due to health issues. Because of the genetic disease I have, I can neither give nor receive donated organs
1601864851.0|AskReddit|tossme68|Yep, my wife tried to add more organ meat to our diet, I'm not a big fan and after a few weeks my big toe hurt really bad.  It took a while to figure out it was gout and not just turf toe.
1601864850.0|AskReddit|Insyte-|Yes
1601864849.0|AskReddit|FarOutSi|Ad Astra is the Apocalypse Now in space. Apocalypse Now used to be one of my favourite movies, then I watched Ad Astra. Such an epic film. Have you seen it?
1601864848.0|AskReddit|123elm|Had footsteps in my old house and once a picture frame was thrown across the room.
1601864848.0|AskReddit|Yeti-lover|Fish sauce
1601864848.0|AskReddit|LiLMosey_10|Even if there was nothing bad about it, it just escalates, and then you just become a normal smoker. Most people using vapes are kids in their late teens anyway
1601864848.0|AskReddit|reditty321|Khan Academy because you get to know a lot of things there like ELA, Math, Social studies, and science
1601864848.0|AskReddit|Wombat_Vs_Car|"I have a friend who was snow boarding and broke his left wrist but he refused to stop snow boarding, we finally convinced the bloody high speed tree hugger that he left had should not be that colour and after him stubbornly telling us he was fine we asked him to hold his hand above his head and slowly it dawned on him that it was not just dirt and maybe he should see a doctor.

ended up with a ton of screws in his hand and a large packet of pain killers but continued on with his manly man routine and claiming he was fine, when he finally feel asleep he whimpered in pain on ever exhale instead of snoring."
1601864847.0|AskReddit|BillNyeTheRedditer|put it in my pocket and watch memes for 24 hours in my house
